id,category_id,technical_requirements,soft_skills,domain_knowledge,education_requirement,experience_level,project_experience
2723,18,"usability, market, strategic, conversion, customer, product, team, moscow, user experience, project, product roadmap, pricing, launch, product management, impact, communication, metrics, leadership, competitive, business, agile, data","strategic, collaboration, time, project, organization, presentation skills, leadership, empathy, customer, roadmap, product, curiosity, analytical, communication",,None,Senior,"user, competitive, roadmap, product, analysis, strategy"
2724,19,"project, data modeling, change, requirements, business, problem solving, agile, functional, process, sql","technical, business, documentation, problem solving",,None,Mid-Level,"requirements, documentation, analysis, process"
2725,19,"business requirements, communication skills, requirements, business, user, agile, functional, process, data, sql, scrum","technical, communication skills, business, documentation",,None,Senior,"requirements, model, process, documentation, analysis"
2726,19,"business requirements, data analysis, project, kpis, bpmn, requirements, business, process modeling, uml, problem solving, jira, confluence, business analysis, process, report, sql, scrum, communication","business, customer, technical, responsibility, active, problem solving, organization skills, report, documentation, communication",,Master,Senior,"requirements, process, report, documentation, analysis"
2727,19,"document, functional requirements, problem solving, confluence, workflow, sql, project, user, jira, microsoft, change, functional, communication, bpmn, process modeling, business, uml, agile, process, data, scrum","teamwork, organization, planning, business, problem solving, responsibility, active, workflow, documentation, analytical, communication",business process modeling,None,Mid-Level,"requirements, process, workflow, documentation, analysis"
2728,19,"problem, data modeling, uml, business, requirements, user, agile, functional, business analysis, process, data, sql, scrum","problem, business, technical, responsibility, learning, documentation, analytical",value,None,Mid-Level,"scenario, requirements, process, documentation, analysis"
2729,19,"business requirements, project, requirements, business, problem solving, business analysis, communication","analytical thinking, teamwork, business, problem solving, documentation, communication",,None,Mid-Level,"requirements, documentation, analysis"
2730,19,"interviews, communication skills, requirement, data, project, requirements, business, problem solving, agile, power, sprint, sql, communication","communication skills, requirement, teamwork, planning, feedback, business, problem solving, responsibility, technical, analytical, communication",,None,Senior,"requirements, analysis"
2731,19,"risk, project, user, problem solving, report, sql, communication","analytical thinking, time, teamwork, planning, feedback, problem solving, customer, report, communication, negotiation skills",,None,Senior,"report, analysis"
2732,19,"project, requirements, business, user, business analysis, functional, sql, communication","business, communication, teamwork",,None,None,"requirements, analysis"
2733,19,"use, data analysis, project, document, root cause analysis, user, business, problem solving, jira, crm, agile, business analysis, process, sql, scrum","analytical thinking, teamwork, planning, business, problem solving, organization skills, customer, learning",,None,Senior,"use, scenario, analysis, process"
2734,19,"project, business, agile, power, sql, communication","teamwork, analytical thinking, planning, business, communication",,None,Senior,analysis
2735,19,"change management, project, kpis, risk, requirements, business, business analysis, process, data, microsoft","decision, planning, business, customer",,Master,None,"build, requirements, analysis, process"
2736,19,"communication skills, market, user, problem solving, process, communication","communication skills, teamwork, planning, problem solving, customer, technical, active, communication",,Bachelor,Senior,"model, analysis, process"
2737,19,"market, root, business, jira, erp, agile, power, sql, scrum, communication","planning, initiative, business, responsibility, analytical, communication",,Bachelor,Mid-Level,"scenario, analysis"
2738,19,"user, business, functional, business analysis, process, data, sql","business, customer, active, learning, documentation, analytical",,None,Senior,"model, documentation, analysis, process"
2739,19,"business requirements, use, communication skills, kpis, user, business, uml, problem solving, jira, confluence, agile, functional, process, data, scrum","communication skills, analytical thinking, decision making, business, problem solving, technical, planning skills, documentation",value,None,None,"use, requirements, process, documentation, analysis"
2740,19,"powerpoint, use, market, kpis, microsoft, change, presentation skills, critical, user, business, business analysis, word, process, data, workflow, power bi, communication","analytical thinking, time, attention, decision making, planning, critical, business, presentation skills, customer, technical, responsibility, organization, workflow, communication",,Bachelor,None,"use, workflow, analysis, process"
2741,19,"project, microsoft, risk, stakeholder management, business, problem solving, jira, stakeholder, communication","analytical thinking, time, teamwork, planning, business, stakeholder communication, problem solving, organization skills, time management, stakeholder, communication",value,None,Mid-Level,stakeholder
2742,19,"project, user, business, jira, agile, business analysis, scrum","analytical thinking, teamwork, initiative, business, customer, learning, documentation",,None,Senior,"documentation, analysis"
2743,19,"business requirements, communication skills, data analysis, business process improvement, document, project, risk, functional requirements, user stories, requirements, business, user, crm, agile, business analysis, process, business case, communication","communication skills, collaboration, feedback, planning, business, customer, technical, time management, negotiation, documentation, communication",,None,None,"requirements, case, process, documentation, analysis"
2744,19,"communication skills, project, requirements, problem solving, jira, confluence, agile, data, scrum","communication skills, analytical thinking, customer, technical, problem solving, active listening, documentation",,None,Senior,"requirements, documentation"
2745,19,"use, project, requirements, business, backlog, impact, stakeholder, business analysis","business, technical, stakeholder, learning, documentation",,None,None,"use, requirements, impact, stakeholder, documentation, analysis"
2746,19,"use, project, requirements, business, user, jira, confluence, agile, business analysis, functional, process, trend, communication","planning, business, technical, learning, negotiation, communication",,None,Senior,"use, requirements, analysis, process"
2747,19,"communication skills, requirements, business, jira, agile, sql, scrum","technical, communication skills, business",,Master,Senior,requirements
2748,19,"interviews, project, document, presentation skills, uml, business, user, power, process, data, sql, scrum, communication, microsoft","time, organization, presentation skills, business, customer, responsibility, technical, learning, analytical, communication",,Master,None,"analysis, process"
2749,19,"project, requirements, business, problem solving, stakeholder, agile, process, scrum, communication","teamwork, business, problem solving, technical, customer, stakeholder, communication",,None,Senior,"stakeholder, requirements, process"
2750,19,"project, document, requirements, business, user, impact, jira, erp, confluence, process, report","planning, report, business, time",,Bachelor,Senior,"requirements, impact, process, report, analysis"
2751,19,"uml, business, user, use case, functional, sql","technical, business",,None,Senior,"use, case, analysis"
2752,19,"use, requirement, data analysis, project, microsoft, workflow diagrams, requirements, business, user, problem solving, presentation, jira, agile, business analysis, process, scrum, communication","requirement, analytical thinking, teamwork, planning, initiative, business, presentation, customer, problem solving, time management, learning, workflow, documentation, communication",,Master,Mid-Level,"use, requirements, model, process, workflow, documentation, analysis"
2753,19,"requirement, project, uml, document",requirement,,None,None,analysis
2754,19,"communication skills, requirements, business, agile, business analysis","technical, communication skills, business, analytical",,None,Senior,"requirements, analysis"
2755,19,"project, kpis, change, presentation skills, requirements, business, user, problem solving, erp, crm, process, sql, communication","time, presentation skills, business, problem solving, documentation, analytical, communication",,None,Senior,"requirements, documentation, analysis, process"
2756,19,"communication skills, market research, data analysis, business, data visualization, business analysis, data","communication skills, planning, business, responsibility, attention to detail, analytical",value,None,Senior,analysis
2757,19,"business requirements, communication skills, requirement, stakeholder analysis, process modeling, business, problem solving, agile, word, process, workflow, scrum","communication skills, requirement, organization, business, problem solving, customer, technical, stakeholder, workflow",,None,Senior,"requirements, stakeholder, process, workflow, analysis"
2758,19,"market, project, requirements, business, problem solving, stakeholder, agile, business analysis, process, scrum, communication","teamwork, business, problem solving, technical, customer, stakeholder, communication",,None,Senior,"stakeholder, requirements, analysis, process"
2759,19,"business requirements, interviews, communication skills, data analysis, project, functional requirements, requirements, business, process","communication skills, collaboration, time, attention, planning, business, technical, time management, documentation, analytical",,None,Senior,"requirements, documentation, analysis, process"
2760,19,"interviews, project, document, presentation skills, uml, user, business, requirements, power, process, data, scrum, communication, microsoft","time, organization, presentation skills, planning, business, customer, responsibility, technical, learning, documentation, analytical, communication",,Master,None,"requirements, documentation, analysis, process"
2761,19,"use, problem, requirement, project, change, user, business, requirements, impact, business analysis, process, communication","problem, requirement, teamwork, time, planning, business, organization skills, documentation, communication",,None,None,"use, requirements, impact, process, documentation, analysis"
2762,19,"business requirements, use, document, dashboards, bpmn, user, business, requirements, impact, jira, confluence, stakeholder, report, sql, communication","feedback, planning, initiative, business, technical, stakeholder, report, documentation, analytical, communication",value,None,Senior,"use, requirements, impact, model, stakeholder, report, documentation, analysis"
2763,19,"business requirements, project, requirements, business, presentation, problem solving, functional, process, data, brd, communication, microsoft","teamwork, analytical thinking, business, presentation, problem solving, communication",,None,None,"build, requirements, process"
2764,19,"document, user, business, requirements, erp, agile, process, data, sql","collaboration, planning, business, technical, documentation",,None,Senior,"requirements, documentation, process"
2765,19,"business requirements, use, project, risk, change, requirements, business, backlog, impact, agile, data, communication","collaboration, time, attention, organization, business, customer, responsibility, flexibility, learning, analytical, communication",value,None,Senior,"use, build, requirements, impact, model, building"
2766,19,"communication skills, requirement, project, user, business, problem solving, agile, functional, business analysis, sql, scrum","communication skills, requirement, teamwork, business, problem solving, time management, analytical",,None,Senior,analysis
2768,19,"communication skills, change management, project, kpis, risk, critical thinking, requirements, business, business analysis, process, data","communication skills, critical thinking, planning, business, customer, flexibility, decision, analytical",,Master,Senior,"build, requirements, analysis, process"
2769,19,"user, requirements, business, problem solving, impact, jira, confluence, erp, functional, business analysis, data","analytical thinking, business, problem solving, technical, learning, documentation",,None,None,"requirements, impact, building, documentation, analysis"
2770,19,"powerpoint, business, problem solving, business analysis, word, process, data, sql, communication","business, problem solving, documentation, analytical, communication",,None,None,"documentation, analysis, process"
2771,19,"use, communication skills, project, tableau, requirements, business, process, data","active, communication skills, business, analytical",,None,None,"use, build, requirements, process, analysis"
2772,19,"use, project, problem solving, business analysis, sql","time, analytical thinking, organization, business, customer, problem solving",,None,Senior,"use, analysis"
2773,19,"requirement, data analysis, change management, market, user, business, problem solving, functional, process, data, communication","requirement, teamwork, analytical thinking, organization, planning, decision making, business, customer, problem solving, time management, communication",value,None,None,"analysis, process"
2774,19,"business requirements, communication skills, requirement, stakeholder analysis, process modeling, business, problem solving, agile, word, process, scrum","communication skills, requirement, organization, business, problem solving, customer, technical, stakeholder",,None,Senior,"stakeholder, requirements, analysis, process"
2775,19,"market, project, requirements, business, problem solving, stakeholder, agile, process, scrum, communication","teamwork, business, problem solving, technical, customer, stakeholder, communication",,None,None,"stakeholder, requirements, process"
2776,19,"communication skills, market, market research, project, metrics, business, impact, crm, data, sql, communication","communication skills, collaboration, organization, business, technical, analytical, communication",value,None,None,"build, analysis, impact"
2777,19,"business requirements, project, bpmn, user, business, problem solving, jira, agile, functional, process, scrum","analytical thinking, time, decision making, initiative, planning, business, feedback, customer, problem solving, responsibility, active, learning, technical",,Bachelor,None,"requirements, process"
2778,19,"use, communication skills, risk, project, business, presentation, problem solving, jira, confluence, functional, process","communication skills, organization, business, presentation, problem solving, analytical",,Master,None,"use, build, process, building, analysis"
2779,19,"business requirements, requirement gathering, communication skills, document, project, user, business, backlog, requirements, problem solving, functional, sql","requirement gathering, communication skills, analytical thinking, planning, decision making, business, problem solving, technical, customer, curiosity, analytical",,None,Senior,"requirements, analysis"
2780,19,"project, kpis, user stories, user, business, impact, stakeholder, agile, data","collaboration, initiative, business, technical, stakeholder, learning",value,None,Senior,"stakeholder, building, impact"
2781,19,"business requirements, use, communication skills, project, user stories, requirements, business, process, data, communication","communication skills, analytical thinking, planning, business, customer, technical, attention to detail, documentation, communication",,None,None,"use, requirements, model, process, documentation, analysis"
2782,19,"user, business, impact, data, communication","organization, learning, business, communication",,None,Senior,"case, analysis, impact"
2783,19,"business requirements, requirement, risk, requirements, user, business, agile, functional, business analysis, sql, scrum","requirement, business, customer",,None,Senior,"requirements, analysis"
2785,19,"business requirements, interviews, communication skills, data analysis, project, functional requirements, requirements, business, process","communication skills, collaboration, time, attention, planning, business, technical, time management, documentation, analytical",,None,Senior,"requirements, documentation, analysis, process"
2786,19,"use, project, requirements, business, user, jira, confluence, agile, business analysis, functional, process, trend, communication","planning, business, technical, learning, negotiation, communication",,None,Senior,"use, requirements, analysis, process"
2788,19,"use, communication skills, market, project, critical, business, impact, data","communication skills, collaboration, organization, critical, business, customer, time management, flexibility, learning, analytical",,None,Senior,"use, build, analysis, impact"
2789,19,"business requirements, requirement, project, requirements, business, user, uml, impact, agile, functional, process, data, scrum","requirement, analytical thinking, planning, feedback, initiative, business, technical, planning skills, documentation",,None,None,"requirements, impact, model, process, documentation, analysis"
2790,19,"market, data analysis, presentation skills, business, business analysis, data, communication","collaboration, presentation skills, business, analytical, communication",,None,Senior,analysis
2791,19,"communication skills, project, functional requirements, user, business, functional, process, sql","communication skills, time, analytical thinking, teamwork, business, customer, technical, documentation",,None,None,"requirements, documentation, analysis, process"
2792,19,"interviews, communication skills, change management, requirement, kpis, project, change, stakeholder management, business, process, data, communication","communication skills, requirement, collaboration, adaptability, feedback, business, stakeholder, analytical, communication",value,None,Senior,"model, stakeholder, process"
2793,19,"interviews, change, presentation skills, user, business, problem solving, agile, functional, process, data, communication","teamwork, presentation skills, business, problem solving, responsibility, technical, learning, negotiation, communication",,None,None,"model, process"
2794,19,"business requirements, process, project, feasibility, critical, requirements, business, uml, functional, power, scrum, communication","teamwork, time, critical, business, customer, learning, documentation, communication",,Master,Senior,"build, requirements, model, process, building, documentation, analysis"
2795,19,"business requirements, project, business, impact, process, data, sql, communication","time, business, technical, analytical, communication",value,None,None,"process, requirements, impact"
2796,19,"business requirements, communication skills, project, metrics, requirements, business, problem solving, functional, sql, communication","communication skills, time, business, problem solving, technical, customer, documentation, analytical, communication",,None,None,"build, requirements, documentation, analysis"
2797,19,"risk, project, change, requirements, business, problem solving, process, data, communication","collaboration, time, organization, planning, decision making, business, customer, technical, problem solving, learning, analytical, communication",value,None,None,"case, requirements, building, process"
2798,19,"market, tableau, user stories, requirements, business, backlog, jira, confluence, process, data, dashboards, sql, communication","planning, business, learning, documentation, communication",value,None,Senior,"requirements, building, documentation, process"
2799,19,"business requirements, communication skills, requirement, stakeholder analysis, process modeling, business, problem solving, agile, word, process, workflow, scrum","communication skills, requirement, organization, business, problem solving, customer, technical, stakeholder, workflow",,None,Senior,"requirements, stakeholder, process, workflow, analysis"
2800,19,"business requirements, requirement, risk, requirements, user, business, agile, functional, business analysis, process, scrum","requirement, business, customer",,None,Senior,"requirements, analysis, process"
2801,19,"project, kpis, user stories, user, business, impact, stakeholder, agile, data","collaboration, initiative, business, technical, stakeholder, learning",value,None,None,"stakeholder, building, impact"
2803,19,"business requirements, interviews, user, business, agile, functional, process, data, sql, scrum, communication","teamwork, business, responsibility, technical, learning, communication",,None,Senior,"model, requirements, process"
2804,19,"business requirements, requirement gathering, communication skills, document, project, user, business, backlog, requirements, problem solving, functional, business analysis, sql","requirement gathering, communication skills, analytical thinking, planning, decision making, business, problem solving, technical, customer, curiosity, analytical",,None,Senior,"requirements, analysis"
2805,19,"business requirements, project, business, impact, process, data, communication","time, business, analytical, communication",value,None,Senior,"process, requirements, impact"
2806,19,"project, requirements, business, jira, sql",business,,None,None,requirements
2807,19,"use, data analysis, project, presentation skills, business, data visualization, agile, process, data","collaboration, presentation skills, planning, business, attention to detail, analytical",,None,Mid-Level,"use, analysis, process"
2808,19,"project, document, critical, requirements, user, business","critical, business",,None,Senior,requirements
2809,19,"business requirements, project, document, user, business, requirements, agile, functional, business analysis, process, word, sql, communication","feedback, planning, clarity, business, technical, documentation, communication",,None,None,"requirements, documentation, analysis, process"
2810,19,"problem, project, business, impact, problem solving, agile, functional, business analysis, process, data, power, communication","problem, analytical thinking, organization, decision making, business, problem solving, technical, responsibility, learning, communication",value,Master,None,"impact, analysis, process"
2811,19,"communication skills, document, project, requirements, business, business analysis, functional","communication skills, business, logical, customer",,None,Senior,"build, requirements, analysis"
2812,19,"business requirements, project, document, user, business, requirements, agile, functional, business analysis, process, word, sql, communication","feedback, planning, clarity, business, technical, documentation, communication",,None,None,"requirements, documentation, analysis, process"
2813,19,"business requirements, use, requirement, change management, process, project, risk, data analysis, user, business, confluence, agile, functional, business analysis, power, data, sql, communication","requirement, analytical thinking, business, customer, technical, responsibility, time management, learning, documentation, communication",value,Master,None,"use, requirements, process, documentation, analysis"
2814,19,"business requirements, project, document, requirements, business, user, agile, functional, process, sql, communication","planning, feedback, clarity, business, technical, documentation, communication",,None,None,"requirements, documentation, analysis, process"
2815,19,"business requirements, risk, document, user, business, functional, process","technical, business, documentation, customer",,None,Senior,"requirements, documentation, process"
2816,19,"business requirements, project, document, user, business, requirements, functional, business analysis, process, gap analysis, sql, communication","feedback, planning, clarity, business, technical, documentation, communication",value,None,None,"requirements, process, gap, documentation, analysis"
2817,19,"requirements, business analysis, workflow, sql, use, project, user, business requirements, change, impact, functional, power, communication, presentation skills, uml, business, agile, process, data","analytical thinking, planning, presentation skills, business, technical, responsibility, active, learning, negotiation, workflow, documentation, communication",value,Master,None,"use, requirements, impact, process, workflow, documentation, analysis"
2818,19,"project, change, feasibility, business, data visualization, agile, functional, process, data, communication","organization, initiative, business, technical, responsibility, active, negotiation, negotiation skills, communication",value,None,Senior,"model, building, analysis, process"
