id,category_id,technical_requirements,soft_skills,domain_knowledge,education_requirement,experience_level,project_experience
3407,24,"project, supply, operations, change, logistics, reporting, cost, business, resource, procurement, quality, team, process, data, communication, efficiency","planning, initiative, organizational skills, customer, team, process, communication",,None,Senior,"logistics, cost, initiative, system, resource, efficiency"
3408,24,"communication skills, time, change, business, operational, quality, team, process, power","communication skills, collaboration, time, professionalism, team, process, analytical",,None,Senior,tracking
3410,24,"microsoft, operations, time, business, quality, team, data, communication","time, attention, feedback, initiative, customer, team, communication",,None,Senior,"initiative, control"
3412,24,"risk, time, daily, logistics, business, resource, performance, team, process, report, production, communication, microsoft","time, initiative, task, team, process, communication",,Bachelor,Senior,"reduction, logistics, system, initiative, resource, tracking, control"
3413,24,"project, reporting, business, operational, erp, continuous, team, process, power bi, microsoft","collaboration, customer, responsibility, stakeholder, continuous, team, process, analytical",,None,Senior,system
3414,24,"communication skills, operations, time, kpi, logistics, reporting, supply, sap, operational, warehouse operations, erp, team, process, inventory management, inventory control, warehouse","communication skills, time, planning, team, process, analytical",,None,Senior,"kpi, logistics, system, inventory, tracking, control"
3415,24,"communication skills, reporting, cost, business, standard, operational, budget, quality, inventory management","planning, communication skills",,None,Senior,"cost, inventory, control, tracking"
3416,24,"communication skills, team","adaptability, communication skills, professionalism, team",,None,None,
3417,24,"project, strategic, reporting, time, compliance, business, performance, data, communication","time, strategic, communication",,None,Senior,
3418,24,"compliance, business, inventory, problem solving, process, power, communication","planning, problem solving, process, analytical, communication",,None,Senior,"inventory, control, tracking"
3419,24,"daily, production, team",team,,None,Mid-Level,
3420,24,"communication skills, operations, team, process, data","communication skills, feedback, initiative, customer, team, process",,None,Senior,"system, initiative, tracking"
3422,24,"communication skills, project, time, daily, cost, business, quality, team, power","communication skills, time, analytical thinking, organizational skills, team",,None,Senior,cost
3423,24,"risk, business, six, quality, team","leadership, initiative, critical, responsibility, team",,None,Senior,initiative
3424,24,"business, budget, quality, team, process, data","attention, task, team, process",,None,Senior,"system, tracking"
3425,24,"communication skills, operations, supply, reporting, business, operational, performance, quality, team, performance monitoring, communication","communication skills, collaboration, adaptability, organizational skills, goal, attention to detail, team, analytical, communication",,None,None,
3426,24,"supply, daily, inventory, problem solving, procurement, team, workflow, communication skills, operations, root, operational, project management, communication, data analysis, logistics, quality control, business, process, data, efficiency","communication skills, collaboration, problem solving, workflow optimization, customer, team, process, communication",,None,None,"optimization, logistics, system, inventory, workflow, control, efficiency"
3427,24,"communication skills, operational performance, operations, supply, daily, logistics, time, business, operational, problem solving, team, process, data, communication, microsoft","communication skills, time, customer focus, planning, critical, initiative, problem solving, customer, team, process, analytical, communication",,None,Junior,"logistics, initiative, planner"
3428,24,"communication skills, data analysis, problem, operations, reporting, change, time, compliance, cost, operational, performance, time management, continuous, team, communication","communication skills, problem, time, leadership, planning, feedback, responsibility, time management, continuous, team, communication",,None,None,"cost, optimization, tracking"
3429,24,"strategic, operations, time, business, team, data, decision, report, communication","strategic, time, feedback, team, negotiation, decision, communication",,None,None,
3431,24,"communication skills, time, performance, quality, team, communication","communication skills, time, feedback, attention to detail, team, communication",,None,None,
3432,24,"data analysis, reporting, daily, time management, data, communication","analytical thinking, planning, responsibility, time management, planning skills, communication",,Bachelor,Intern,"system, tracking"
3433,24,"risk, operations, operational, performance, team, process, data, daily operations, report","responsibility, team, process",,None,None,control
3434,24,"communication skills, strategic, daily, business, performance, team, report, communication","communication skills, strategic, leadership, customer, responsibility, team, communication",,None,Mid-Level,system
3436,24,"communication skills, business, team, process, data","communication skills, multitask, attention, organizational, customer, team, process",,Bachelor,Intern,
3437,24,"process, operations, supply, reporting, demand, operational, team, power, data, communication, efficiency","attention, planning, leadership, customer, team, process, analytical, communication",,None,None,efficiency
3438,24,"strategic, supply, operations, time, logistics, compliance, continuous improvement, business, quality, team, process, project management, communication","strategic, time, critical thinking, leadership, team management, continuous, team, process, communication",,None,Intern,logistics
3440,24,"erp systems, reporting, efficiency, team, data, microsoft","analytical, team",,Bachelor,None,"system, efficiency"
3443,24,"communication skills, risk, operations, reporting, compliance, quality, team, report","communication skills, analytical, team",,None,None,system
3444,24,"data, problem, communication","problem, communication",,None,None,
3445,24,"communication skills, process, operations, performance, efficiency, team, power, project management, communication","communication skills, feedback, responsibility, team, process, analytical, communication",,Master,None,"track, efficiency"
3447,24,"communication skills, strategic, project, business, quality, team, process, report, microsoft","communication skills, strategic, feedback, organizational, customer, team, process",,Bachelor,None,
3448,24,"communication skills, reporting, time, business, team, communication","communication skills, time, planning, initiative, responsibility, team, negotiation, communication",,None,None,initiative
3449,24,"six sigma, supply, cost, performance, team, operations management, warehouse, power bi, production, communication skills, project, operations, capacity, microsoft, kaizen, lean, data analysis, logistics, business, process, data","communication skills, collaboration, analytical thinking, leadership, critical, customer, stakeholder, team, process, analytical",lean,None,None,"optimization, logistics, cost, study, control"
3450,24,"communication skills, operations, cost, operational, communication","communication skills, planning, organizational skills, task, communication",,None,Mid-Level,"cost, system, control, tracking"
3451,24,"communication skills, data analysis, operations, capacity, team","communication skills, goal, team",,None,None,
3452,24,"communication skills, business, performance, problem solving, team, performance monitoring","communication skills, collaboration, problem solving, customer, team",,None,None,track
3453,24,"logistics, warehouse, warehouse operations",,,None,None,logistics
3454,24,"erp systems, operations, change, logistics, sap, performance, continuous, team, process, data, warehouse, communication","leadership, customer, team management, continuous, team, process, communication",,None,Expert,"logistics, system"
3455,24,"change management, risk, strategic, change, operations, project, business, performance, team, process, data, project management, operational excellence","strategic, feedback, organizational, customer, team, process, analytical",,Master,Senior,optimization
3456,24,"communication skills, business operations, business, performance, team, power, decision, communication","communication skills, planning, task, team, decision, communication",,None,Senior,
3458,24,"problem, communication skills, reporting, daily, compliance, business, quality, team, process, root, communication","problem, communication skills, analytical thinking, leadership, customer, task, team, process, analytical, communication",,None,None,
3459,24,"budget, standard, process","attention, process",,None,None,
3460,24,"data analysis, operations, supply, performance, continuous, quality, team, process, data","planning, responsibility, continuous, team, process",,None,Senior,"track, optimization"
3461,24,"strategic, operations, time, daily, logistics, compliance, business, operational, performance, efficiency, quality, team, process, data, communication","accountability, strategic, collaboration, time, customer, attention to detail, team, process, analytical, communication",,None,None,"logistics, track, system, control, efficiency"
3462,24,"strategic, risk, cost, business, budget, team, power, report, communication, efficiency","accountability, strategic, customer, responsibility, stakeholder, team, strategic thinking, communication",,None,None,"track, cost, system, efficiency"
3463,24,"risk, operations, time, daily, root cause analysis, operational, continuous, quality, team, process, data, production, microsoft","continuous, time, team, process",,Bachelor,None,
3464,24,"communication skills, process, risk, operations, strategic, daily, reporting, compliance, operational, strategic planning, communication, efficiency","communication skills, strategic, planning, initiative, process, communication",,None,None,"system, initiative, efficiency"
3465,24,"vendor, operations, logistics, compliance, communication","negotiation, communication",,None,None,logistics
3466,24,"communication skills, process, operations, time, business, efficiency, team, power, capacity, production, communication","communication skills, time, organizational, customer, team, process, communication",,None,None,efficiency
3467,24,"data analysis, strategic, operations, reporting, kpi, business, performance, problem solving, team, process, data, production, efficiency","strategic, leadership, problem solving, team, process",,None,Mid-Level,"kpi, optimization, control, efficiency"
3468,24,"supply, time, business, process, warehouse","time, process",,None,None,
3469,24,"project, operations, time, business, team, communication","responsibility, time, team, communication",,None,Senior,tracking
3470,24,"strategic, project, time, business, problem solving, performance, communication","time, planning, initiative, customer, problem solving, task, strategic thinking, communication",,None,Senior,initiative
3471,24,"communication skills, risk, operations, change, project, strategic, daily, business, operational, procurement, team, process, data, decision, capacity, operations management, microsoft","communication skills, strategic, resilience, adaptability, attention, planning, leadership, feedback, customer, responsibility, team, process, decision, analytical",,Master,Intern,"system, reduction"
3472,24,"change, business, quality, team, production","attention, team, customer",,None,None,system
3474,24,"communication skills, risk, operations, change, project, strategic, daily, business, operational, procurement, team, process, data, decision, capacity, operations management, microsoft","communication skills, strategic, resilience, adaptability, attention, planning, leadership, feedback, customer, responsibility, team, process, decision, analytical",,Master,Intern,"system, reduction"
3475,24,"vendor, communication skills, business operations, daily, continuous improvement, compliance, business, operational, time management, erp, quality, team, process, data, project management, efficiency","communication skills, collaboration, initiative, organizational, customer, time management, continuous, attention to detail, team, process, analytical",,None,None,"initiative, study, efficiency"
3476,24,"microsoft, operations, reporting, quality control, continuous improvement, business, budget, team, process, data, power, communication","customer, continuous, team, process, communication",,None,Senior,"system, control"
3477,24,"data analysis, change management, strategic, reporting, business, budget, budget management, team, strategic planning, efficiency","team management, leadership, strategic, planning",,None,Senior,"control, efficiency"
3478,24,"compliance, quality control, performance, quality, team, production, efficiency","team management, leadership, team, analytical thinking",,None,None,"control, efficiency"
3479,24,"data analysis, kaizen, operations, daily, demand, business, operational, performance, inventory, lean, team, process, data, warehouse, production, efficiency","planning, leadership, customer, team management, team, process",lean,None,None,"track, inventory, efficiency"
3480,24,"vendor, problem, change management, project, operations, inventory, operational, performance, team, inventory management","problem, team",,None,Senior,"system, inventory"
3481,24,"project, business, operational, capacity, team, data, project management, production, microsoft","task, leadership, team, customer",,None,None,
3482,24,"process, risk, operations, root cause analysis, compliance, business, operational, performance, quality, team, power, data","team, process",,None,None,"reduction, control"
3483,24,"communication skills, microsoft, operations, logistics, continuous improvement, compliance, operational, performance, resource, efficiency, continuous, team, data, team leadership, production, communication","communication skills, leadership, planning, team management, continuous, team, communication",,None,None,"logistics, system, resource, efficiency"
3484,24,"communication skills, strategic, project, time, logistics, business, quality, team, data, report, project management, communication","communication skills, strategic, time, leadership, critical, goal, team, communication",,None,Senior,"logistics, track"
3485,24,"risk, reporting, compliance, business, team, data, communication","analytical thinking, team management, attention to detail, negotiation, communication",,None,Senior,control
3486,24,"communication skills, strategic, operations, business, performance, team, strategic planning, data, report, communication","communication skills, strategic, analytical thinking, adaptability, planning, leadership, organizational skills, responsibility, team, analytical, communication",,Bachelor,None,control
3487,24,"business, production, strategic, operational","strategic, customer",,Bachelor,None,
3488,24,"process, strategic, time, compliance, performance, team, capacity, power, communication","accountability, process, strategic, resilience, time, leadership, team, negotiation, communication",,None,None,system
3489,24,"logistics, warehouse, warehouse operations",,,None,None,logistics
3490,25,"seo, content, google, client, performance, team, performance metrics","analytical, team, time",,None,None,
3492,25,"content, lead, lead generation, digital, marketing, performance, digital marketing, social, marketing campaigns, media, content marketing, email campaigns, brand, event, event marketing, campaign, paid, communication","leadership, marketing, brand, communication",,None,Senior,"digital, marketing, brand, campaign, strategy"
3493,25,"press releases, digital, marketing, social, media, crm, brand, communication","creative, strategic, marketing, brand, communication",,None,None,"digital, marketing, brand"
3495,25,"communication skills, market research, market, marketing, competitive, performance, customer, product, team, sales","communication skills, strategic, analytical thinking, feedback, leadership, marketing, customer, team, sales",,Bachelor,None,"market, marketing, sales, customer"
3496,25,"content, data analysis, communication skills, advertising, excel, digital, marketing, presentation, performance, media, data, paid, sales","communication skills, sales, marketing, presentation, strategic thinking, analytical",,Bachelor,Senior,"digital, marketing, sales, strategy"
3497,25,"communication skills, market, marketing, brand management, brand positioning, performance, product, brand, team, negotiation, sales, communication","analytical, communication skills, time, marketing, flexibility, brand, team, negotiation, sales, communication",,None,None,"market, marketing, brand, sales, strategy"
3498,25,"conversion, google ads, digital, marketing, performance, customer, team, content, market research, social, crm, marketing campaigns, brand, sales, kpi, advertising, google, digital marketing, seo, data analysis, google analytics, sem, facebook, email","marketing, customer, brand, team, sales",,None,Senior,"market, digital, marketing, customer, brand, sales, strategy"
3499,25,"revenue growth, advertising, conversion, lead, facebook, google ads, marketing, campaign management, competitive, performance, revenue, media, team, campaign","strategic, creative, leadership, marketing, team",roi,None,None,"campaign, marketing"
3500,25,"powerpoint, market, excel, digital, marketing, performance, customer, product, team, value proposition, content, revenue growth, social, crm, brand, sales, trade, media, communication, collaboration","storytelling, creative, collaboration, initiative, marketing, customer, team, brand, sales, communication",,Bachelor,None,"market, digital, marketing, customer, brand, sales, strategy"
3501,25,"market, collaboration, email, performance, client, customer, crm, product, team, brand, communication","collaboration, time, feedback, relationship, customer, team, brand, analytical, communication",,None,None,"market, brand, customer"
3503,25,"content, communication skills, target audience, marketing, social, media, product, brand, team, negotiation, sales, communication","communication skills, creative, time, initiative, marketing, relationship, responsibility, flexibility, team, brand, negotiation, sales, communication",,None,None,"marketing, sales, brand, awareness"
3504,25,"communication skills, market, trade, marketing, competitive, presentation, brand management, performance, team, brand, product, sales","communication skills, creative, analytical thinking, leadership, marketing, presentation, problem solving, responsibility, active, brand, team, sales",,None,Intern,"market, marketing, awareness, brand, sales, strategy"
3505,25,"market, collaboration, lead, digital, marketing, customer, social, team, product, data, value, sales","sales, collaboration, time, marketing, customer, team, analytical",,None,Senior,"market, digital, marketing, customer, sales, strategy"
3506,25,"communication skills, trade, digital, presentation, client, customer, data, campaign, communication, negotiation skills","communication skills, time, initiative, goal, presentation, customer, responsibility, problem solving, active, communication, analytical, negotiation skills","pricing, roi",Bachelor,Senior,"segmentation, digital, customer, campaign, strategy"
3507,25,"content, data analysis, advertising, marketing, brand, team, market trends, campaign, sales, communication","sales, marketing, brand, team, analytical, communication",,None,None,"market, marketing, brand, campaign, sales"
3508,25,"marketing strategy, market research, advertising, digital, marketing, customer, digital marketing, crm, public relations, product, team, data, brand, sales, communication","strategic, analytical thinking, leadership, feedback, marketing, customer, communication, team, brand, sales, public",,None,Senior,"market, digital, marketing, customer, brand, sales, strategy"
3509,25,"press, marketing, brand management, customer, target, media, brand, product, sales, communication","creative, analytical thinking, marketing, customer, brand, sales, communication",,Bachelor,None,"customer, marketing, brand, sales"
3511,25,"content, market, advertising, email, digital, marketing, competitive, social, media, revenue, public relations, brand, team, data, product, value, paid, sales","strategic, marketing, team, brand, sales, public",,None,None,"market, digital, marketing, awareness, brand, sales, strategy"
3512,25,"marketing strategy, market, data, lead, presentation skills, digital, marketing, email, customer, crm, team, product, product launches, value, sales, communication","presentation skills, marketing, customer, team, sales, communication",pricing,Bachelor,None,"market, digital, marketing, customer, sales, strategy"
3513,25,"market, conversion, marketing, brand management, performance, customer, brand positioning, product, team, product launches, content, communication skills, brand, paid, sales, advertising, lead, value, performance metrics, data","communication skills, sales, strategic, time, leadership, critical, marketing, feedback, customer, brand, team, analytical",,None,Junior,"market, marketing, customer, brand, sales, strategy"
3514,25,"communication skills, market, digital, marketing, brand management, performance, digital marketing, media, product, brand, data, team, sales, communication","analytical, communication skills, creative thinking, marketing, responsibility, brand, team, sales, communication","pricing, digital marketing trends",None,None,"market, digital, marketing, awareness, brand, sales, strategy"
3515,25,"sales targets, communication skills, market, revenue growth, collaboration, excel, marketing, performance, customer, revenue, team, sales strategy, data, value, sales","communication skills, sales, strategic, collaboration, marketing, customer, team, analytical",,None,Senior,"market, marketing, customer, sales, strategy"
3516,25,"trade shows, lead, presentation skills, competitive, performance, revenue, crm, pipeline, event, negotiation, salesforce, team, hubspot, sales","presentation skills, flexibility, team, negotiation, sales",,None,None,sales
3517,25,"google ads, digital, marketing, performance, target, content, target audience, content marketing, social, brand, sales, advertising, kpi, google, digital marketing, media, communication, seo, data analysis, google analytics, sem, facebook","analytical, creative thinking, marketing, brand, sales, communication",roi,None,Senior,"digital, marketing, awareness, model, brand, sales, strategy"
3518,25,"lead, digital, marketing, competitive, performance, market trends, revenue, crm, brand, team, data, campaign, communication","strategic, time, leadership, marketing, brand, team, analytical, communication",roi,None,None,"market, digital, marketing, brand, campaign"
3519,25,"digital, marketing, brand management, customer, product, team, product launches, market research, content marketing, social, brand, sales, negotiation skills, advertising, trade, branding, communication, collaboration, pipeline, data, social media marketing","creative, collaboration, marketing, customer, responsibility, time management, brand, team, negotiation skills, sales, communication",pricing,None,None,"market, digital, marketing, customer, brand, sales"
3520,25,"content, communication skills, target audience, marketing, social, media, product, brand, team, negotiation, sales, communication","communication skills, creative, time, initiative, marketing, relationship, responsibility, flexibility, team, brand, negotiation, sales, communication",,None,None,"marketing, sales, brand, awareness"
3521,25,"communication skills, market, data, collaboration, lead, digital, marketing, media, target, brand, team, product launches, branding, sales, negotiation skills","communication skills, collaboration, marketing, team, brand, sales, negotiation skills",,None,None,"market, digital, marketing, brand, sales, strategy"
3522,25,"market, collaboration, target audience, marketing, competitive, brand management, performance, media, brand, team, data, product, value, paid, sales, communication","collaboration, marketing, brand, team, sales, communication",pricing,Bachelor,Senior,"market, marketing, brand, sales, strategy"
3523,25,"seo, content, market, google analytics, digital, google, performance, content marketing","marketing, time",,None,None,"market, digital, marketing"
3524,25,"market, digital, marketing, customer, product, team, content, sales enablement, marketing campaigns, sales, data, lead, upsell, competitive analysis, communication, competitive, revenue, pipeline, market trends","marketing, customer, team, sales, communication",,None,None,"market, automation, digital, marketing, awareness, customer, sales, strategy"
3525,25,,"leadership, goal",,None,Intern,
3526,25,"trade, marketing, brand management, social, brand, product, sales, negotiation skills","sales, marketing, active, brand, analytical, negotiation skills",,Master,None,"marketing, brand, sales"
3527,25,"b2c, digital, marketing, presentation, performance, digital marketing, marketing campaigns, brand, campaign, sales, communication","marketing, presentation, time management, brand, sales, communication",,Bachelor,Senior,"digital, marketing, brand, campaign, sales"
