id,category_id,technical_requirements,soft_skills,domain_knowledge,education_requirement,experience_level,project_experience
2761,19,"use, problem, requirement, project, change, user, business, requirements, impact, business analysis, process, communication","problem, requirement, teamwork, time, planning, business, organization skills, documentation, communication",Unknown,Unknown,Unknown,"use, requirements, impact, process, documentation, analysis"
2762,19,"business requirements, use, document, dashboards, bpmn, user, business, requirements, impact, jira, confluence, stakeholder, report, sql, communication","feedback, planning, initiative, business, technical, stakeholder, report, documentation, analytical, communication",value,Unknown,Senior,"use, requirements, impact, model, stakeholder, report, documentation, analysis"
2763,19,"business requirements, project, requirements, business, presentation, problem solving, functional, process, data, brd, communication, microsoft","teamwork, analytical thinking, business, presentation, problem solving, communication",Unknown,Unknown,Unknown,"build, requirements, process"
2764,19,"document, user, business, requirements, erp, agile, process, data, sql","collaboration, planning, business, technical, documentation",Unknown,Unknown,Senior,"requirements, documentation, process"
2765,19,"business requirements, use, project, risk, change, requirements, business, backlog, impact, agile, data, communication","collaboration, time, attention, organization, business, customer, responsibility, flexibility, learning, analytical, communication",value,Unknown,Senior,"use, build, requirements, impact, model, building"
2766,19,"communication skills, requirement, project, user, business, problem solving, agile, functional, business analysis, sql, scrum","communication skills, requirement, teamwork, business, problem solving, time management, analytical",Unknown,Unknown,Senior,analysis
2768,19,"communication skills, change management, project, kpis, risk, critical thinking, requirements, business, business analysis, process, data","communication skills, critical thinking, planning, business, customer, flexibility, decision, analytical",Unknown,Master,Senior,"build, requirements, analysis, process"
2769,19,"user, requirements, business, problem solving, impact, jira, confluence, erp, functional, business analysis, data","analytical thinking, business, problem solving, technical, learning, documentation",Unknown,Unknown,Unknown,"requirements, impact, building, documentation, analysis"
2770,19,"powerpoint, business, problem solving, business analysis, word, process, data, sql, communication","business, problem solving, documentation, analytical, communication",Unknown,Unknown,Unknown,"documentation, analysis, process"
2771,19,"use, communication skills, project, tableau, requirements, business, process, data","active, communication skills, business, analytical",Unknown,Unknown,Unknown,"use, build, requirements, process, analysis"
2772,19,"use, project, problem solving, business analysis, sql","time, analytical thinking, organization, business, customer, problem solving",Unknown,Unknown,Senior,"use, analysis"
2773,19,"requirement, data analysis, change management, market, user, business, problem solving, functional, process, data, communication","requirement, teamwork, analytical thinking, organization, planning, decision making, business, customer, problem solving, time management, communication",value,Unknown,Unknown,"analysis, process"
2774,19,"business requirements, communication skills, requirement, stakeholder analysis, process modeling, business, problem solving, agile, word, process, scrum","communication skills, requirement, organization, business, problem solving, customer, technical, stakeholder",Unknown,Unknown,Senior,"stakeholder, requirements, analysis, process"
2775,19,"market, project, requirements, business, problem solving, stakeholder, agile, process, scrum, communication","teamwork, business, problem solving, technical, customer, stakeholder, communication",Unknown,Unknown,Unknown,"stakeholder, requirements, process"
2776,19,"communication skills, market, market research, project, metrics, business, impact, crm, data, sql, communication","communication skills, collaboration, organization, business, technical, analytical, communication",value,Unknown,Unknown,"build, analysis, impact"
2777,19,"business requirements, project, bpmn, user, business, problem solving, jira, agile, functional, process, scrum","analytical thinking, time, decision making, initiative, planning, business, feedback, customer, problem solving, responsibility, active, learning, technical",Unknown,Bachelor,Unknown,"requirements, process"
2778,19,"use, communication skills, risk, project, business, presentation, problem solving, jira, confluence, functional, process","communication skills, organization, business, presentation, problem solving, analytical",Unknown,Master,Unknown,"use, build, process, building, analysis"
2779,19,"business requirements, requirement gathering, communication skills, document, project, user, business, backlog, requirements, problem solving, functional, sql","requirement gathering, communication skills, analytical thinking, planning, decision making, business, problem solving, technical, customer, curiosity, analytical",Unknown,Unknown,Senior,"requirements, analysis"
2780,19,"project, kpis, user stories, user, business, impact, stakeholder, agile, data","collaboration, initiative, business, technical, stakeholder, learning",value,Unknown,Senior,"stakeholder, building, impact"
2781,19,"business requirements, use, communication skills, project, user stories, requirements, business, process, data, communication","communication skills, analytical thinking, planning, business, customer, technical, attention to detail, documentation, communication",Unknown,Unknown,Unknown,"use, requirements, model, process, documentation, analysis"
2782,19,"user, business, impact, data, communication","organization, learning, business, communication",Unknown,Unknown,Senior,"case, analysis, impact"
2783,19,"business requirements, requirement, risk, requirements, user, business, agile, functional, business analysis, sql, scrum","requirement, business, customer",Unknown,Unknown,Senior,"requirements, analysis"
2785,19,"business requirements, interviews, communication skills, data analysis, project, functional requirements, requirements, business, process","communication skills, collaboration, time, attention, planning, business, technical, time management, documentation, analytical",Unknown,Unknown,Senior,"requirements, documentation, analysis, process"
2786,19,"use, project, requirements, business, user, jira, confluence, agile, business analysis, functional, process, trend, communication","planning, business, technical, learning, negotiation, communication",Unknown,Unknown,Senior,"use, requirements, analysis, process"
2788,19,"use, communication skills, market, project, critical, business, impact, data","communication skills, collaboration, organization, critical, business, customer, time management, flexibility, learning, analytical",Unknown,Unknown,Senior,"use, build, analysis, impact"
2789,19,"business requirements, requirement, project, requirements, business, user, uml, impact, agile, functional, process, data, scrum","requirement, analytical thinking, planning, feedback, initiative, business, technical, planning skills, documentation",Unknown,Unknown,Unknown,"requirements, impact, model, process, documentation, analysis"
2790,19,"market, data analysis, presentation skills, business, business analysis, data, communication","collaboration, presentation skills, business, analytical, communication",Unknown,Unknown,Senior,analysis
2791,19,"communication skills, project, functional requirements, user, business, functional, process, sql","communication skills, time, analytical thinking, teamwork, business, customer, technical, documentation",Unknown,Unknown,Unknown,"requirements, documentation, analysis, process"
2792,19,"interviews, communication skills, change management, requirement, kpis, project, change, stakeholder management, business, process, data, communication","communication skills, requirement, collaboration, adaptability, feedback, business, stakeholder, analytical, communication",value,Unknown,Senior,"model, stakeholder, process"
2793,19,"interviews, change, presentation skills, user, business, problem solving, agile, functional, process, data, communication","teamwork, presentation skills, business, problem solving, responsibility, technical, learning, negotiation, communication",Unknown,Unknown,Unknown,"model, process"
2794,19,"business requirements, process, project, feasibility, critical, requirements, business, uml, functional, power, scrum, communication","teamwork, time, critical, business, customer, learning, documentation, communication",Unknown,Master,Senior,"build, requirements, model, process, building, documentation, analysis"
2795,19,"business requirements, project, business, impact, process, data, sql, communication","time, business, technical, analytical, communication",value,Unknown,Unknown,"process, requirements, impact"
2796,19,"business requirements, communication skills, project, metrics, requirements, business, problem solving, functional, sql, communication","communication skills, time, business, problem solving, technical, customer, documentation, analytical, communication",Unknown,Unknown,Unknown,"build, requirements, documentation, analysis"
2797,19,"risk, project, change, requirements, business, problem solving, process, data, communication","collaboration, time, organization, planning, decision making, business, customer, technical, problem solving, learning, analytical, communication",value,Unknown,Unknown,"case, requirements, building, process"
2798,19,"market, tableau, user stories, requirements, business, backlog, jira, confluence, process, data, dashboards, sql, communication","planning, business, learning, documentation, communication",value,Unknown,Senior,"requirements, building, documentation, process"
2799,19,"business requirements, communication skills, requirement, stakeholder analysis, process modeling, business, problem solving, agile, word, process, workflow, scrum","communication skills, requirement, organization, business, problem solving, customer, technical, stakeholder, workflow",Unknown,Unknown,Senior,"requirements, stakeholder, process, workflow, analysis"
2800,19,"business requirements, requirement, risk, requirements, user, business, agile, functional, business analysis, process, scrum","requirement, business, customer",Unknown,Unknown,Senior,"requirements, analysis, process"
2801,19,"project, kpis, user stories, user, business, impact, stakeholder, agile, data","collaboration, initiative, business, technical, stakeholder, learning",value,Unknown,Unknown,"stakeholder, building, impact"
2803,19,"business requirements, interviews, user, business, agile, functional, process, data, sql, scrum, communication","teamwork, business, responsibility, technical, learning, communication",Unknown,Unknown,Senior,"model, requirements, process"
2804,19,"business requirements, requirement gathering, communication skills, document, project, user, business, backlog, requirements, problem solving, functional, business analysis, sql","requirement gathering, communication skills, analytical thinking, planning, decision making, business, problem solving, technical, customer, curiosity, analytical",Unknown,Unknown,Senior,"requirements, analysis"
2805,19,"business requirements, project, business, impact, process, data, communication","time, business, analytical, communication",value,Unknown,Senior,"process, requirements, impact"
2806,19,"project, requirements, business, jira, sql",business,Unknown,Unknown,Unknown,requirements
2807,19,"use, data analysis, project, presentation skills, business, data visualization, agile, process, data","collaboration, presentation skills, planning, business, attention to detail, analytical",Unknown,Unknown,Mid-Level,"use, analysis, process"
2808,19,"project, document, critical, requirements, user, business","critical, business",Unknown,Unknown,Senior,requirements
2809,19,"business requirements, project, document, user, business, requirements, agile, functional, business analysis, process, word, sql, communication","feedback, planning, clarity, business, technical, documentation, communication",Unknown,Unknown,Unknown,"requirements, documentation, analysis, process"
2810,19,"problem, project, business, impact, problem solving, agile, functional, business analysis, process, data, power, communication","problem, analytical thinking, organization, decision making, business, problem solving, technical, responsibility, learning, communication",value,Master,Unknown,"impact, analysis, process"
2811,19,"communication skills, document, project, requirements, business, business analysis, functional","communication skills, business, logical, customer",Unknown,Unknown,Senior,"build, requirements, analysis"
2812,19,"business requirements, project, document, user, business, requirements, agile, functional, business analysis, process, word, sql, communication","feedback, planning, clarity, business, technical, documentation, communication",Unknown,Unknown,Unknown,"requirements, documentation, analysis, process"
2813,19,"business requirements, use, requirement, change management, process, project, risk, data analysis, user, business, confluence, agile, functional, business analysis, power, data, sql, communication","requirement, analytical thinking, business, customer, technical, responsibility, time management, learning, documentation, communication",value,Master,Unknown,"use, requirements, process, documentation, analysis"
2814,19,"business requirements, project, document, requirements, business, user, agile, functional, process, sql, communication","planning, feedback, clarity, business, technical, documentation, communication",Unknown,Unknown,Unknown,"requirements, documentation, analysis, process"
2815,19,"business requirements, risk, document, user, business, functional, process","technical, business, documentation, customer",Unknown,Unknown,Senior,"requirements, documentation, process"
2816,19,"business requirements, project, document, user, business, requirements, functional, business analysis, process, gap analysis, sql, communication","feedback, planning, clarity, business, technical, documentation, communication",value,Unknown,Unknown,"requirements, process, gap, documentation, analysis"
2817,19,"requirements, business analysis, workflow, sql, use, project, user, business requirements, change, impact, functional, power, communication, presentation skills, uml, business, agile, process, data","analytical thinking, planning, presentation skills, business, technical, responsibility, active, learning, negotiation, workflow, documentation, communication",value,Master,Unknown,"use, requirements, impact, process, workflow, documentation, analysis"
2818,19,"project, change, feasibility, business, data visualization, agile, functional, process, data, communication","organization, initiative, business, technical, responsibility, active, negotiation, negotiation skills, communication",value,Unknown,Senior,"model, building, analysis, process"
2819,19,"requirements, business analysis, workflow, sql, use, project, user, business requirements, change, impact, functional, power, communication, presentation skills, uml, business, agile, process, data","analytical thinking, planning, presentation skills, business, technical, responsibility, active, learning, negotiation, workflow, documentation, communication",value,Master,Unknown,"use, requirements, impact, process, workflow, documentation, analysis"
2820,19,"business requirements, use, communication skills, project, document, functional requirements, critical, requirements, business, user, problem solving, jira, confluence, agile, data, scrum","communication skills, analytical thinking, organization, planning, critical, business, customer, technical, problem solving, active listening, documentation",Unknown,Unknown,Senior,"use, requirements, case, model, documentation, analysis"
2821,19,"business requirements, communication skills, document, risk, user stories, requirements, business, user, agile, business analysis, process, business case, communication","documentation, communication skills, collaboration, adaptability, feedback, planning, business, customer, technical, time management, negotiation skills, planning skills, curiosity, analytical, communication",Unknown,Unknown,Unknown,"requirements, case, process, documentation, analysis"
2822,19,"communication skills, project, presentation skills, functional requirements, uml, business, user, problem solving, agile, business analysis, functional, process, data, scrum","communication skills, analytical thinking, organization, presentation skills, business, customer, technical, problem solving, technical writing, documentation, analytical",Unknown,Unknown,Senior,"requirements, documentation, analysis, process"
2823,19,"project, requirements, business, user, stakeholder, process, sql","organization, business, customer, technical, stakeholder, documentation",Unknown,Unknown,Unknown,"requirements, stakeholder, process, documentation, analysis"
2824,19,"business requirements, requirement, risk, requirements, user, business, agile, functional, business analysis, process, scrum","requirement, business, customer",Unknown,Unknown,Mid-Level,"requirements, analysis, process"
2826,19,"interviews, change, presentation skills, user, business, problem solving, agile, functional, process, data, communication","teamwork, presentation skills, business, problem solving, responsibility, technical, learning, negotiation, communication",Unknown,Unknown,Unknown,"model, process"
2827,19,"interviews, change, presentation skills, user, business, problem solving, agile, functional, process, data, communication","teamwork, presentation skills, business, problem solving, responsibility, technical, learning, negotiation, communication",Unknown,Unknown,Unknown,"model, process"
2828,19,"interviews, change, presentation skills, business, problem solving, agile, functional, process, data, sql, communication","teamwork, presentation skills, business, problem solving, responsibility, technical, learning, negotiation, communication",Unknown,Unknown,Unknown,"model, process"
2829,19,"interviews, change, presentation skills, user, business, problem solving, agile, functional, process, data, communication","teamwork, presentation skills, business, problem solving, responsibility, technical, learning, negotiation, communication",Unknown,Unknown,Unknown,"model, process"
2830,19,"interviews, communication skills, user, business, problem solving, jira, agile, functional, process, data, power bi, sql, scrum, communication","communication skills, organization, planning, business, problem solving, responsibility, technical, time management, learning, customer, negotiation skills, communication",value,Master,Senior,"model, process"
2831,19,"business requirements, requirement gathering, communication skills, document, project, user, business, backlog, requirements, problem solving, functional, sql","requirement gathering, communication skills, analytical thinking, planning, decision making, business, problem solving, technical, customer, curiosity, analytical",Unknown,Unknown,Unknown,"requirements, analysis"
2832,19,"interviews, change, user, business, problem solving, functional, process, data, communication","analytical thinking, business, problem solving, responsibility, technical, learning, communication",Unknown,Unknown,Senior,"model, analysis, process"
2833,19,"interviews, change, presentation skills, user, business, problem solving, agile, functional, process, data, sql, communication","teamwork, presentation skills, business, problem solving, responsibility, technical, learning, negotiation, communication",Unknown,Unknown,Unknown,"model, process"
2834,19,"change, user, business, problem solving, agile, functional, process, data, sql, microsoft","teamwork, business, problem solving, responsibility, technical, learning",Unknown,Unknown,Unknown,"model, process"
2835,19,"interviews, requirements, business, user, problem solving, process, data, sql, communication","business, customer, responsibility, technical, problem solving, learning, communication",Unknown,Unknown,Senior,"model, requirements, analysis, process"
2836,19,"interviews, communication skills, user, business, problem solving, functional, process, data, sql, communication","communication skills, organization, planning, business, problem solving, responsibility, technical, time management, learning, negotiation skills, communication",value,Unknown,Senior,"model, process"
2837,19,"use, communication skills, data analysis, project, presentation skills, business, data visualization, agile, process, data","communication skills, collaboration, presentation skills, business, attention to detail, analytical",Unknown,Unknown,Mid-Level,"use, analysis, process"
2838,19,"business requirements, interviews, requirements, business, user, agile, functional, process, data, sql, scrum, communication","teamwork, business, responsibility, technical, learning, communication",Unknown,Unknown,Senior,"model, requirements, process"
2839,19,"interviews, communication skills, market, data analysis, project, functional requirements, requirements, business, user, impact, problem solving, agile, functional, process, data, power, communication","communication skills, teamwork, analytical thinking, planning, business, customer, technical, responsibility, problem solving, learning, time management, analytical, communication",value,Master,Unknown,"impact, requirements, analysis, process"
2840,19,"interviews, functional requirements, requirements, problem solving, business analysis, sql, communication skills, project, user, business requirements, change management, impact, functional, power, communication, data analysis, business, stakeholder, agile, process, data, scrum","communication skills, analytical thinking, planning, decision making, business, problem solving, technical, responsibility, time management, learning, stakeholder, communication",value,Master,Mid-Level,"requirements, impact, stakeholder, process, analysis"
2841,19,"business requirements, project, document, bpmn, user, business, requirements, uml, agile, functional, business analysis, process, word, business case, sql, communication","feedback, planning, clarity, business, technical, documentation, communication",Unknown,Unknown,Senior,"requirements, case, process, documentation, analysis"
2842,19,"business requirements, risk, document, user, business, functional, process","technical, business, documentation, customer",Unknown,Unknown,Senior,"requirements, documentation, process"
2843,20,"problem, process, project, systems, analytical thinking, software, business, problem solving, agile, functional, it, business analysis, data, sql, scrum","problem, project, analytical thinking, business, problem solving, documentation",Unknown,Unknown,Senior,"data, analysis"
2844,20,"system, technical, configuration, hardware, it, infrastructure","technical, initiative",Unknown,Unknown,Unknown,"technical, system"
2845,20,"analytical thinking, requirements, problem solving, sdlc, workflow, sql, infrastructure, use, communication skills, project, system, software, integration, microsoft, requirement, uml, business, agile, it, data, scrum","communication skills, project, time, analytical thinking, organization, business, problem solving, requirement analysis, learning, workflow, documentation",Unknown,Unknown,Senior,"requirement, planning, system, uml, model, integration, data, workflow, analysis"
2846,20,"data, systems, system, business, software, technical, sdlc, it, software engineering, sql, analytical, infrastructure","presentation skills, initiative, business, technical, analytical",Unknown,Unknown,Unknown,"system, technical, model, data, analysis"
2847,20,"it systems, it","learning, curiosity, team, interpersonal skills",Unknown,Unknown,Unknown,Unknown
2848,20,"analytical thinking, systems, system, requirements, business, performance, it, process, communication","analytical thinking, business, time management, team, documentation, communication",system development life cycle,Master,Unknown,"system, analysis"
2849,20,"requirement, communication skills, change, systems, system, requirements, business, software, uml, technical, sdlc, business analysis, it, process, data, functional, scrum, analytical","requirement, communication skills, adaptability, business, technical, time management, team, analytical",Unknown,Unknown,Unknown,"requirement, document, system, uml, technical, data, analysis"
2850,20,"requirements, sdlc, confluence, business analysis, sql, use, problem, communication skills, project, requirements analysis, software, jira, system requirements, capacity, analytical, technical documentation, functional, business, technical, stakeholder, agile, it, data","accountability, problem, communication skills, project, conflict, organization, attention, business, technical, responsibility, stakeholder, learning, team, documentation, analytical",Unknown,Unknown,Unknown,"document, optimization, planning, system, technical, data, analysis"
2851,20,"communication skills, project, systems, infrastructure, system, business, technical, hardware, it, integration, analytical, microsoft","communication skills, project, time, business, technical, flexibility, active, team, analytical",Unknown,Unknown,Unknown,"technical, system, integration"
