id,category_id,technical_requirements,soft_skills,domain_knowledge,education_requirement,experience_level,project_experience
1004,7,"security, vpn, security awareness, data protection, endpoint, siem, information, threat, access, identity, dlp, network security, secure, cyber, security policies, information security, application security, it, data","communication skills, time, critical, security, research, technical, learning, threat, team, analytical","threat modeling, identity and access management",None,Senior,"siem, firewall"
1005,7,"secure, risk, cyber, iso 27001, network, security, data privacy, web, information security, information, it","communication skills, risk, time, initiative, security, team, communication",,Bachelor,None,policy
1006,7,"dlp, security, data privacy, web, it, soc","time, critical, security, technical, team, analytical",,Bachelor,None,"firewall, policy"
1007,7,"burp suite, network security, secure, cyber, compliance, penetration, security, cybersecurity, application, web, information security, owasp, application security, information, it, data, vulnerability","compliance, security, technical, team, integrity",forensic,None,Senior,"vulnerability, penetration, testing"
1008,7,"network security, compliance, ips, security, vpn, data privacy, information security, ssl, information, incident, web, firewalls, access, ids, it","accountability, problem, communication skills, analytical thinking, time, compliance, initiative, security, problem solving, technical, incident, team, report",,None,None,"planning, firewall, policy, incident, response"
1009,7,"secure, log, cyber, iso 27001, network, security, data privacy, web, iso, it, access, gdpr","problem, communication skills, attention, critical thinking, security, presentation, problem solving, team, report, documentation, analytical",defense,Bachelor,None,"implementation, planning, integration, policy"
1010,7,"dlp, data, log, risk management, security, siem, social, information, it, access, vulnerability, it security, endpoint, gdpr","risk, time, presentation skills, security, technical, report, communication",,Bachelor,None,"vulnerability, siem, policy, testing"
1011,7,"cyber, security policies, iso 27001, security, application, information security, information, application security, it, gdpr","communication skills, security, team, communication",,None,Mid-Level,test
1012,7,"dlp, penetration testing, risk, iso 27001, penetration, security, information security, iso, information, it, vulnerability, gdpr","communication skills, risk, risk assessment, security, documentation, communication",,None,Mid-Level,"vulnerability, planning, penetration, penetration testing"
1013,7,"network security, risk, network, security, vpn, firewalls, it, data","communication skills, risk, security, team, documentation, analytical",,None,None,"planning, firewall"
1014,7,"data, network, penetration, security, penetration test, web, application, information, vulnerability, gdpr","security, research, problem solving, technical, presentation, team",,None,None,"vulnerability, test, planning, penetration"
1015,7,"network, ips, security, vpn, application, information, it, access","critical, security, research, team, documentation, communication",,None,Senior,firewall
1055,8,"gcp, hybrid, cloud platforms, cloud, aws, devops, azure, infrastructure","technical, system, analytical",,None,Senior,"on, design, optimization, cloud, infrastructure"
1061,8,"monitoring, infrastructure","communication skills, project, collaboration, time, problem solving, technical, incident, solution",,None,None,"on, monitoring, project, infrastructure"
1062,8,"cloud, public cloud, new, identity","problem, communication skills, collaboration, learning, stakeholder, curiosity",,None,None,"on, cloud, design, strategy"
1073,8,"cloud, kubernetes, new, identity","communication skills, learning",,None,None,"on, cloud, kubernetes"
1075,8,"storage, identity, new","technical, system, solution",,None,Mid-Level,on
1081,8,"cloud, public cloud, new, identity","accountability, collaboration, time, change, system, technical, flexibility, learning, curiosity",,Bachelor,Senior,"on, design, cloud, deploy, strategy"
1096,8,"iam, cloud, api, identity, new, identity and access management, infrastructure","technical, system, learning",,None,Senior,"on, design, cloud, strategy, deployment, infrastructure"
1098,8,"cloud, public cloud, new, identity","reliability, collaboration, time, system, critical, client, technical, learning",,Bachelor,None,"on, cloud, deploy, strategy"
1100,8,"functions, azure",,,None,None,"design, optimization"
1118,8,"cloud services, private, aws, s3, lambda, new, infrastructure","reliability, collaboration, technical, flexibility, communication",,None,Senior,"on, design, optimization, monitor, infrastructure, cloud, deployment, strategy"
1123,8,"cloud, identity, new, infrastructure","accountability, system, flexibility, learning, curiosity, communication",,Bachelor,None,"on, design, monitor, cloud, infrastructure"
1127,8,"cloud, public cloud, new, identity","accountability, collaboration, troubleshooting, flexibility, learning, curiosity",,None,None,"on, cloud, monitor, strategy"
1130,8,"identity, new, infrastructure","technical, learning, solution",,None,Senior,"on, design, deployment, infrastructure"
1131,8,"regions, cloud, public cloud, kubernetes, openstack, identity, docker, new","technical, learning, documentation",,None,None,"on, design, cloud, kubernetes, deploy"
1134,8,"cloud, identity, virtual, new","problem, communication skills, time, change, system, technical, troubleshooting, learning, communication",,None,Senior,"on, cloud"
1136,8,"storage, storage solutions, cloud","communication skills, reliability, technical, flexibility, learning",,None,None,"cloud, design"
1142,8,aws,"communication skills, learning, system",,None,None,"on, design, deployment"
1147,8,"private cloud, cloud, public cloud, kubernetes, openstack, identity, new","learning, problem, system, solution",,None,Senior,"on, cloud, kubernetes"
1151,8,"cloud, public cloud, new, identity","responsibility, technical, learning, collaboration",,Bachelor,None,"on, cloud, strategy"
1152,8,"storage, private cloud, cloud, public cloud, kubernetes, openstack, public, containers, devops, serverless, identity, new, infrastructure","accountability, problem, reliability, collaboration, flexibility, learning, curiosity",,None,None,"on, cloud, kubernetes, strategy, deployment, serverless, infrastructure"
1153,8,"cloud, public cloud, identity, monitoring, new","technical, learning, collaboration",,Bachelor,None,"on, design, monitor, cloud, deploy, monitoring, strategy"
1160,8,"storage, availability, microsoft, functions, kubernetes, cost, api, datadog, cloud security, cloud solutions, monitoring, devops, cloud architecture, azure, docker, terraform, infrastructure","reliability, resilience, time, collaboration, system, incident",,None,None,"on, design, monitor, cloud, deploy, kubernetes, cost, monitoring, infrastructure"
1170,8,"grafana, cloud, kubernetes, cost, cloud engineer, datadog, devops, prometheus, iac, terraform","technical, troubleshooting, critical, communication",,None,Senior,"on, design, cloud, kubernetes, cost, deployment, strategy"
1172,8,"amazon, vms, cloud infrastructure, infrastructure, cloud, google, kubernetes, public, containers, devops, identity, docker, new, microsoft","learning, system, time",,None,None,"on, design, cloud, kubernetes, infrastructure"
1176,8,"cloud, public cloud, virtual, monitoring, identity, cloud computing, new","problem, communication skills, collaboration, change, system, technical, troubleshooting, learning, communication",,Bachelor,Senior,"on, cloud, monitoring, strategy"
1177,8,"storage, cloud, public cloud, kubernetes, private, cost, aws, public, identity, cloud computing, azure, docker, google cloud, new, infrastructure","accountability, project, collaboration, time, initiative, technical, flexibility, learning, workflow, curiosity, solution",,Master,None,"on, design, project, cloud, kubernetes, cost, strategy, infrastructure"
1179,8,"cloud, kubernetes, identity, docker, new, microsoft","responsibility, workflow, learning, collaboration",,None,None,"on, cloud, kubernetes, design"
1182,8,"identity, new","communication skills, problem solving, technical, troubleshooting, client, learning, incident, time management, stress, documentation, solution",,None,None,on
1183,8,"regions, cloud, public cloud, identity, new","collaboration, system, technical, learning, curiosity, documentation",,Bachelor,None,"on, cloud, strategy"
1185,8,"availability, gcp, private, aws, cloud security, infrastructure","communication skills, project, solution, time",,None,None,"on, cloud, project, infrastructure"
1197,8,"new, infrastructure","technical, planning, project",,None,Senior,"on, design, project, infrastructure"
1203,8,"cloud, identity, new, ansible","collaboration, system, technical, learning, communication",,None,None,"on, cloud"
1204,8,"storage, regions, cloud, kubernetes, public cloud, openstack, identity, new","time, responsibility, technical, learning, documentation",,None,None,"on, cloud, kubernetes, strategy"
1205,8,"cloud, kubernetes, public cloud, identity, devops, docker, new","communication skills, collaboration, critical, clarity, technical, learning, documentation",,Master,Senior,"on, cloud, kubernetes, deployment, strategy"
1208,8,"private cloud, cloud, public cloud, kubernetes, openstack, identity, new","learning, system, solution",,None,None,"on, cloud, kubernetes"
1209,8,"storage, private cloud, gcp, cloud infrastructure, cloud, kubernetes, private, public cloud, openstack, cloud solutions, aws, identity, cloud computing, azure, google cloud, new, infrastructure","project, time, learning, solution, communication",,Bachelor,Senior,"on, design, project, cloud, kubernetes, infrastructure"
1210,8,"iam, identity, identity and access management","technical, troubleshooting, communication skills",,None,None,setup
1211,8,"cloud, kubernetes, public cloud, identity, devops, docker, new","communication skills, collaboration, critical, clarity, technical, learning, documentation",,Master,Senior,"on, cloud, kubernetes, deployment, strategy"
1216,9,,continuous learning,,None,None,"architecture, and"
1217,9,user,"communication skills, user, documentation",,None,None,and
1219,9,,"communication, collaboration, time",,None,Intern,"and, testing"
1220,9,,"responsibility, attention to detail, analytical",,Master,None,"test, and"
1221,9,,time,,None,None,and
1222,9,"technical, system, it, infrastructure","technical, communication, teamwork",,None,None,and
1223,9,"technical, active","planning, coordination, client, technical, responsibility, continuous learning, workflow, communication",,None,Senior,and
1224,10,"database administration, high availability, schema design, mongodb, data normalization, cloud, oracle, postgresql, performance, query, data, database, azure, execution, sql","discipline, reporting, team, documentation, communication",,None,None,"design, optimization, performance, schema, query, data, database"
1226,10,"high, service, database management, mongodb, restore, backup, postgresql, performance, cassandra, query, index, capacity, data, database, failover","communication skills, analytical thinking, problem solving, task, team",,None,Senior,"restore, backup, performance, query, index, data, database"
1230,10,"database management, performance, database, microsoft sql server, sql, high availability, user, oracle, indexing, postgresql, database security, nosql, query, azure, mysql, database backup, etl, google, cloud, backup, data",reporting,,None,None,"replication, optimization, indexing, backup, performance, query, data, database"
1231,10,"storage, high, high availability, service, database management, cloud, mysql, disaster recovery, oracle, backup, performance, nosql, capacity, database, sql","problem, organization, planning, compliance, customer, incident, team, decision, communication",,None,Senior,"tuning, design, backup, performance, database, migration"
1232,10,"database management, mysql, oracle, performance, data, database, sql","compliance, team",,None,None,"data, database, optimization, performance"
1233,10,"python, shell scripting, performance, database, database monitoring, sql, stored, high availability, indexing, oracle, postgresql, database security, query, encryption, automation, mongodb, performance tuning, cloud, backup, execution plan, database migration, data, query optimization",team,,None,Senior,"tuning, design, optimization, indexing, migration, backup, performance, routine, query, data, database, query optimization"
1234,10,"azure sql, performance, database, microsoft sql server, sql, nosql databases, disaster recovery, indexing, postgresql, nosql, database security, query, schema design, mongodb, mysql, data integrity, google, cloud database, cassandra, cloud, backup, dba",integrity,,None,None,"replication, design, indexing, backup, performance, schema, query, data, database"
1235,10,"python, database management, shell scripting, performance, database, sql, nosql databases, postgresql, mongodb, automation, oltp, mysql, database backup, etl, relational, performance tuning, cloud, data, query optimization",team,,Bachelor,Senior,"replication, tuning, design, backup, performance, data, database, query optimization"
1236,10,"python, performance, database, nosql databases, high availability, disaster recovery, indexing, postgresql, nosql, bash, restore, data warehousing, automation, mongodb, data integrity, cassandra, failover, service, bi, backup, schema, dba, data, query optimization","time, reporting, attention to detail, team, integrity, documentation, analytical, communication",,None,Senior,"replication, design, restore, indexing, backup, performance, schema, data, database, query optimization"
1237,10,"automation, shell scripting, oracle, backup, database",team,,None,None,"database, backup"
1238,10,"capacity planning, storage, python, database management, mongodb, user, oracle, backup, performance, shell scripting, data replication, postgresql, query, capacity, data, database, sql","accountability, organization, planning, compliance, customer, responsibility, problem solving, technical, team, report",,Bachelor,Senior,"tuning, replication, backup, performance, query, data, database, migration"
1239,10,"python, database administration, mongodb, mysql, oracle, postgresql, data, database, microsoft sql server, sql, database design","discipline, communication skills, problem solving, documentation, analytical",,None,None,"data, database, design"
1240,10,"high availability, mongodb, data integrity, backup, performance, database security, dba, database, failover, sql",integrity,,None,None,"optimization, backup, performance, data, database"
1241,10,"bi tools, functions, azure sql, performance, database, sql, nosql databases, high availability, indexing, oracle, postgresql, database security, query, mysql, views, performance tuning, stored procedures, dba, data, query optimization, database design","reporting, time, compliance, learning, team, decision, report, analytical, communication",,None,None,"tuning, design, optimization, indexing, performance, query, data, database, query optimization"
1243,10,"storage, powershell, disaster recovery, backup, performance, bash, data","problem, reporting, responsibility, technical, learning, team, documentation, communication",,None,Senior,"data, backup, performance"
1244,10,"high availability, performance tuning, mongodb, automation, user, oracle, performance, nosql, postgresql, cloud database, failover, encryption, capacity, data, database, azure","communication skills, critical, documentation, team",,None,None,"tuning, replication, performance, data, database"
1245,10,"high, service, mysql, oracle, cassandra, nosql, dba, data, database","technical, project, communication",,None,Mid-Level,"data, database, project"
1246,10,"database administration, high, database management, performance tuning, cloud, disaster recovery, oracle, backup, performance, failover, data, database, azure, sql, microsoft","communication skills, analytical thinking, change, reporting, problem solving, responsibility, technical, learning, team",,None,Senior,"tuning, backup, performance, routine, data, database"
1247,10,"high, high availability, database management, performance tuning, automation, oltp, cloud, oracle, er, data, database, sql","project, analytical thinking, organization, decision making, problem solving, technical, responsibility, learning, team, communication",,Master,None,"tuning, project, performance, data, database"
1248,10,"database administration, high, service, automation, cloud, mysql, performance, dba, data, database","time, critical, technical, attention to detail, team, integrity, analytical",,None,None,"tuning, design, performance, data, database"
1254,11,"c, signal processing, signal, sensor, simulation, control, control systems","discipline, communication skills, project, teamwork, engineering, learning, documentation",,Bachelor,None,"project, system, signal, processing, sensor, integration, process"
1255,11,"c, noise, debugging, hardware design, prototyping, hardware, power, control, control systems","time, debugging, engineering, testing, safety, precision, documentation, communication",,None,None,"prototyping, system"
1256,11,i2c,"problem, teamwork, engineering, documentation, communication",,None,Junior,"system, integration, process"
1257,11,"hardware, power","project, time, engineering, initiative, technical, continuous, communication",,None,Senior,project
1258,11,power,"project, engineering, planning, testing, technical",,None,Senior,"project, process"
1259,11,,"communication skills, creative, analytical thinking, teamwork, engineering, problem solving, learning, continuous, analytical",,None,Senior,
1260,11,"c, simulink, signal processing, matlab, power, simulation, control, control systems","project, engineering, technical, task, documentation",,None,None,"project, system, signal, processing, unit, process"
1261,11,"power electronics, control systems","communication skills, creative, project, analytical thinking, teamwork, engineering, problem solving, testing, technical, communication",,None,Senior,"system, project"
1263,11,"matlab, digital","engineering, initiative, communication",,PhD,None,system
1264,11,"control, assembly","project, communication, time",,None,Senior,project
1265,11,"simulation, matlab, signal processing, control","technical, engineering, planning, communication",,Master,None,"system, integration, signal, processing"
1266,11,"matlab, simulink, control, control systems","systematic, engineering, testing, troubleshooting, planning skills, communication",,None,None,system
1267,11,"analog, hardware test, ltspice, simulation, hardware design","project, engineering, planning, technical, documentation, communication",,None,Mid-Level,"system, project"
1269,11,,,,PhD,None,
1270,11,,"technical, engineering, communication skills, time",,None,None,
1271,11,"digital, control, power","accountability, communication skills, time, engineering, focus, safety, responsibility, continuous, learning, logical, communication",,Bachelor,Junior,system
1272,11,"control, power","collaboration, attention, engineering, testing, communication",,None,Entry Level,
1273,11,,"communication skills, project, engineering, planning, responsibility, technical, learning, continuous",,Master,None,project
1274,11,digital,"project, engineering, technical, continuous, learning, documentation",,None,Senior,project
1275,11,"analog, digital","time, engineering, problem solving, technical, learning, continuous, logical, communication",,None,Entry Level,"system, process"
1277,11,control,"project, collaboration, time, engineering, planning, safety, technical, documentation, communication",,Bachelor,None,"system, project"
1278,11,"simulation, control systems","accountability, communication skills, project, engineering, continuous improvement, safety, technical, troubleshooting, learning, communication",,None,Senior,"system, project, process"
1279,11,"c, noise, debugging, hardware design, prototyping, hardware, power, control, control systems","time, debugging, engineering, testing, safety, precision, documentation, communication",,None,None,"prototyping, system"
1280,11,"altium, circuit design, fpga, pcb layout, hardware, simulation, hardware design","time, teamwork, engineering, analytical thinking, problem solving, technical, time management, safety, learning, documentation, communication",,Bachelor,Senior,"pcb, system, integration, process"
1281,11,"pcb design, altium, digital, vhdl, analog, power, circuit, hardware design","engineering, initiative, testing",,None,None,"unit, pcb"
1282,11,"c, altium, kicad, sensor, pcb, power, schematic, hardware design","project, collaboration, attention, engineering, testing",,None,Senior,"project, system, sensor, coding, integration, pcb"
1283,11,"control, hardware design","engineering, communication skills",,None,Mid-Level,process
1284,11,sensor,"analytical thinking, engineering, problem solving, technical, task, communication",,None,Senior,"system, sensor, integration, processing"
1285,11,"pcb design, spi, pcb, assembly","teamwork, analytical thinking, engineering, technical, documentation",,None,Mid-Level,"pcb, process"
1286,11,"control, power","teamwork, analytical thinking, engineering, continuous improvement, planning, safety, technical, documentation",,None,Senior,"system, process"
1287,11,"embedded, logic, embedded systems, signal processing, fpga, debugging, verilog, prototyping, digital, analog, hardware, serial, simulation, circuit, control","communication skills, debugging, time, engineering, initiative, focus, safety, technical, learning, documentation",,None,Senior,"embedded, prototyping, signal, processing, process"
1288,11,"pcb design, altium designer, multisim, power, control systems, hardware test, pcb, hardware, simulation, schematic, hardware design","project, teamwork, analytical thinking, engineering, problem solving, responsibility, technical, documentation",,None,Senior,"system, integration, project, pcb"
1289,11,"digital, hardware, power, control, hardware design","project, adaptability, engineering, technical, logical, communication",,None,Mid-Level,"system, project"
1290,11,"embedded, device, hardware testing, c programming, hardware","testing, continuous, learning, time",,None,None,"embedded, process"
1291,11,"control systems, control, power","technical, engineering",,None,Senior,"system, integration"
1292,11,"altium designer, embedded linux, i2c, spi, uart, prototyping, digital, analog, hardware, pcb, circuit, oscilloscope, hardware design","project, analytical thinking, time, engineering, planning, documentation, communication",,None,Senior,"prototyping, embedded, project, pcb"
1293,11,,"project, communication",,None,Senior,project
1294,11,"schematic, matlab, digital, power, simulation, control","discipline, project, time, teamwork, engineering, planning, testing, technical, problem solving, attention to detail, technical communication, communication",,Bachelor,Mid-Level,"system, project, integration, process"
1295,11,power,"project, teamwork, engineering, planning, technical, communication",,None,None,"system, project, integration"
1296,11,"altium, circuit design, fpga, digital, analog, control systems, hardware, power, pcb layout, power electronics, hardware design","engineering, planning, safety, technical, communication",,None,Junior,"system, pcb, process"
1297,11,,"communication skills, project, engineering, planning, responsibility, technical, learning, continuous",,Master,None,project
1298,11,control,"project, safety, communication",,None,Senior,"system, project, process"
1299,11,"device, hardware, power, control, control systems","project, creative, time, engineering, focus, technical, continuous, communication",,None,None,"system, project"
1300,11,"digital, control, power","project, collaboration, time, engineering, planning, safety, technical, responsibility",,Bachelor,Entry Level,"system, project, process"
1301,11,"altium designer, embedded, fpga, debugging, matlab, digital, hardware, assembly, arm, schematic, pcb design, spi, hardware design, microprocessors, pcb, power, i2c, serial, uart, circuit design, microcontrollers, signal, vhdl, ltspice, circuit, oscilloscope","communication skills, debugging, engineering, initiative, testing, responsibility, task, analytical, communication",,None,None,"embedded, process, system, signal, integration, pcb"
1302,11,control,"technical, engineering, project, teamwork",,None,None,project
1303,11,circuit,"systematic, project, teamwork, time, engineering, initiative, testing, technical",,None,Mid-Level,project
1304,11,device,"communication skills, teamwork, analytical thinking, engineering, problem solving, responsibility, task, communication",,None,None,
1305,11,"pcb design, i2c, spi, uart, fpga, circuit design, altium, oscilloscope, analog, ltspice, hardware, pcb, schematic, hardware design","project, teamwork, analytical thinking, engineering, problem solving, technical, time management, safety, learning, communication",,Bachelor,Senior,"pcb, system, project, integration"
1306,11,"circuit, assembly","creative, engineering, continuous improvement, responsibility, technical, continuous",,None,Senior,process
1307,11,"signal processing, matlab, digital, hdl, vhdl, analog, hardware, hardware design","engineering, initiative, communication",,None,None,"unit, signal, processing"
1308,11,"logic, analog, power, simulation, oscilloscope, hardware design","teamwork, analytical thinking, engineering, problem solving, technical",,None,None,
1309,11,matlab,"technical, engineering, communication",,None,None,"system, integration"
1311,11,c,"engineering, testing, teamwork",,None,Senior,integration
