id,category_id,technical_requirements,soft_skills,domain_knowledge,education_requirement,experience_level,project_experience
3304,24,"project, kpi, operations, daily, logistics, supply, business, operational, performance, efficiency, team, process, data, warehouse, communication","analytical thinking, planning, goal, organizational skills, customer, responsibility, team management, team, process, communication",Unknown,Unknown,Senior,"logistics, kpi, efficiency"
3306,24,"reporting, compliance, cost, business, operational, performance, budget, quality, team, warehouse","planning, team",Unknown,Unknown,Senior,"cost, system"
3307,24,"strategic, supply, reporting, cost, demand, inventory, standard, performance, quality, team, warehouse, communication skills, operations, resource planning, capacity, capacity planning, change, continuous improvement, standard operating procedures, operational, sops, daily operations, time, logistics, business, process, data, efficiency","communication skills, strategic, time, planning, feedback, initiative, critical, customer, responsibility, continuous, attention to detail, team, process",Unknown,Unknown,Senior,"planner, logistics, system, cost, inventory, resource, tracking, initiative, allocation, control, efficiency"
3308,24,"communication skills, reporting, business, performance, budget, budget management, team, report","communication skills, planning, organizational skills, team, analytical",Unknown,Unknown,Unknown,Unknown
3309,24,"vendor, strategic, supply, business, operational, performance, standard, quality, team, process, efficiency","process, strategic, collaboration, planning, customer, team, negotiation, analytical",Unknown,Unknown,Expert,"allocation, efficiency"
3310,24,"time, reporting, logistics, cost, sap, business, warehouse operations, inventory, cost reduction, erp, quality, inventory control, sops, data, warehouse, operational excellence, efficiency",time,Unknown,Bachelor,Unknown,"reduction, logistics, cost, system, inventory, control, efficiency"
3311,24,"business, communication","leadership, communication, customer",Unknown,Bachelor,Unknown,Unknown
3312,24,"communication skills, data analysis, reporting, change, business, performance, quality, team, process, data, project management, communication","communication skills, customer, responsibility, stakeholder, team, process, communication",Unknown,Unknown,Senior,Unknown
3313,24,"operations, operational excellence, compliance, inventory, business, performance, operational, team, inventory management, root","collaboration, feedback, leadership, responsibility, team management, team",Unknown,Unknown,Unknown,"track, inventory"
3314,24,"communication skills, project, operations, business, operational, team, process, report, project management","accountability, communication skills, feedback, organizational skills, organizational, customer, attention to detail, stakeholder, team, process, multitasking",Unknown,Unknown,Intern,"track, study, tracking"
3315,24,"operational, production, team","planning, team",Unknown,Bachelor,Senior,Unknown
3316,24,"operations, business, performance, team, data, report, project management, communication","multitask, customer, team management, team, communication",Unknown,Unknown,Unknown,Unknown
3317,24,"operations, time, performance, problem solving, efficiency, quality, team, data, workflow, project management, communication","collaboration, time, planning, customer, problem solving, team, workflow, analytical, communication",Unknown,Unknown,Unknown,"workflow, control, efficiency"
3318,24,"strategic, supply, reporting, business, inventory, performance, budget, process, data, production, communication, microsoft","strategic, planning, customer, responsibility, process, communication",Unknown,Unknown,Senior,inventory
3319,24,"operations, supply, daily, change, cost, business, inventory, problem solving, quality, team, strategic planning, power, communication","strategic, analytical thinking, customer focus, leadership, planning, problem solving, customer, team, communication",Unknown,Unknown,Unknown,"cost, inventory"
3320,24,"logistics, change, production, time",time,Unknown,Unknown,Senior,logistics
3321,24,"communication skills, project, operations, team, process, power","communication skills, team, process",Unknown,Unknown,Intern,Unknown
3322,24,"data analysis, strategic, operations, business, performance, team, project management, communication","collaboration, goal, strategic thinking, team, communication",Unknown,Unknown,Unknown,optimization
3323,24,"vendor, strategic, risk, reporting, daily, performance, quality, team, project, operations, continuous, change, compliance, continuous improvement, operational, logistics, business, process, data","strategic, resilience, planning, leadership, organizational skills, organizational, customer, responsibility, continuous, team, process",Unknown,Unknown,Unknown,"logistics, system, control, tracking"
3325,24,"project, supply, strategic, compliance, sap, time management, quality, team, process, data, production, power","strategic, planning, time management, team, process",Unknown,Bachelor,Unknown,Unknown
3326,24,time,time,Unknown,Unknown,Unknown,Unknown
3327,24,"communication skills, supply, time, change, demand, sap, performance, problem solving, team, process, report, project management, production","communication skills, time, analytical thinking, conflict, planning, problem solving, customer, team, process, negotiation skills",Unknown,Unknown,Unknown,control
3328,24,"strategic, reporting, time, continuous improvement, problem solving, budget, team, process, capacity","strategic, time, leadership, goal, problem solving, continuous, team, process, analytical",Unknown,Unknown,Mid-Level,track
3329,24,"communication skills, risk, reporting, cost, business, performance, time management, budget, budget management, lean, team, quality, report, production, communication, efficiency","communication skills, multitask, planning, leadership, responsibility, time management, team, analytical, communication",lean,Bachelor,Unknown,"track, cost, system, efficiency"
3330,24,"operations, time, logistics, compliance, cost, sap, business, team, report, microsoft","attention, planning, team, time",Unknown,Unknown,Unknown,"logistics, track, cost"
3331,24,"report, business, operational, communication","responsibility, communication",Unknown,Unknown,Senior,Unknown
3332,24,"strategic, operations, decision making, business, operational, resource, performance, problem solving, team, process, data, decision, communication, microsoft","strategic, decision making, critical, leadership, planning, customer, problem solving, team, process, decision, communication",Unknown,Unknown,Unknown,"allocation, optimization, resource"
3333,24,"communication skills, strategic, microsoft, reporting, business operations, process optimization, business, operational, efficiency, team, data, project management, communication","communication skills, strategic, collaboration, critical, professionalism, organizational, attention to detail, team, process, multitasking, communication",Unknown,Unknown,Unknown,"track, optimization, efficiency"
3334,24,"operations, operational excellence, compliance, inventory, business, performance, operational, team, inventory management, root","collaboration, feedback, leadership, responsibility, team management, team",Unknown,Unknown,Unknown,"track, inventory"
3335,24,"communication skills, strategic, project, change, cost, sap, business, operational, performance, budget, team, process, data, production","communication skills, strategic, collaboration, planning, customer, team, process, analytical",Unknown,Bachelor,Unknown,"track, cost, control"
3336,24,"operational performance, supply, daily, logistics, cost, inventory, warehouse operations, operational, performance, team, inventory management, warehouse, efficiency","leadership, customer, team management, attention to detail, team",Unknown,Unknown,Unknown,"logistics, cost, inventory, control, efficiency"
3337,24,"communication skills, business, operational, performance, efficiency","communication skills, planning",Unknown,Bachelor,Senior,"tracking, efficiency"
3338,24,"process, strategic, operations, time, continuous improvement, business, operational, continuous, team, sops, operational excellence, efficiency","strategic, collaboration, time, leadership, continuous, team, process, analytical",Unknown,Unknown,Unknown,"tracking, efficiency"
3339,24,"data analysis, risk, operations, reporting, strategic, compliance, business, operational, team, process, data, risk mitigation, communication, efficiency","strategic, collaboration, feedback, critical, leadership, customer, team, process, communication",Unknown,Bachelor,Unknown,efficiency
3340,24,"supply, business operations, compliance, business, quality, team, process, communication","process, resilience, initiative, customer, team, negotiation, communication",Unknown,Unknown,Unknown,initiative
3341,24,"reporting, decision making, cost, operational, problem solving, quality, team, capacity, production, efficiency","leadership, decision making, problem solving, team management, task, team",Unknown,Unknown,Senior,"cost, efficiency"
3342,24,"workflow, risk, reporting, compliance, operational, process, data, report, communication","task, process, workflow, communication",Unknown,Unknown,Senior,"workflow, system, control"
3343,24,"daily, compliance, inventory, performance, demand forecast, quality, team, process, capacity, report, power","feedback, customer, team, process, negotiation",Unknown,Unknown,Unknown,inventory
3345,24,"project, reporting, sap, performance, team, process, report, communication","analytical thinking, customer, team management, team, process, communication",Unknown,Unknown,Senior,control
3346,24,"production, business, team",team,Unknown,Unknown,Unknown,Unknown
3348,24,"communication skills, reporting, business, time management, budget","time management, communication skills, task, analytical thinking",Unknown,Unknown,Senior,Unknown
3349,24,"six sigma, strategic, operational metrics, daily, cost, performance, operations management, workflow, operations, operational excellence, compliance, continuous improvement, operational, time management, lean, daily operations, communication, data analysis, business, resource, budget, process, data, efficiency","strategic, planning, organizational, time management, continuous, process, workflow, analytical, communication",lean,Unknown,Senior,"cost, resource, allocation, workflow, efficiency"
3350,24,"communication skills, process, operations, daily, logistics, problem solving, team, sops, data, daily operations, microsoft excel","communication skills, multitask, organizational, customer, problem solving, attention to detail, team, process, analytical",Unknown,Unknown,Unknown,"logistics, control"
3351,24,"communication skills, data analysis, strategic, operations, supply, business, performance, quality, team, data, communication","communication skills, strategic, feedback, goal, team, communication",Unknown,Unknown,Unknown,Unknown
3352,24,"business, operational, team, process, data, communication","organizational skills, attention to detail, team, process, multitasking, communication",Unknown,Unknown,Unknown,Unknown
3353,24,"problem, strategic, project, reporting, business, erp, team, process, data, communication","problem, strategic, team, process, analytical, communication",Unknown,Bachelor,Unknown,Unknown
3354,24,"business, project, power",Unknown,Unknown,Unknown,Unknown,control
3356,24,"communication skills, process, business, performance, quality, team, performance monitoring, production","communication skills, collaboration, feedback, customer, team, process",Unknown,Unknown,Senior,"track, optimization, study"
3357,24,daily operations,task,Unknown,Unknown,Unknown,Unknown
3358,24,"strategic, operations, supply, continuous improvement, compliance, cost, business, operational, performance, continuous, quality, team, production","accountability, continuous, strategic thinking, team",Unknown,Unknown,Unknown,cost
3361,24,"communication skills, reporting, time, business, team, communication","communication skills, time, planning, initiative, responsibility, team, negotiation, communication",Unknown,Unknown,Unknown,initiative
3362,24,"communication skills, compliance, sap, business, performance, team, data, communication, microsoft","communication skills, initiative, attention to detail, team, analytical, communication",Unknown,Unknown,Unknown,"initiative, control"
3363,24,"communication skills, strategic, project, operations, daily, standard, performance, six, budget, team, process, data, project management, production, communication","communication skills, strategic, task, team, process, analytical, communication",Unknown,Unknown,Expert,"study, tracking"
3364,24,"kpi, operations, reporting, time, business, performance, team, warehouse","responsibility, time, team, customer",Unknown,Unknown,Unknown,kpi
3366,24,"six sigma, daily, compliance, quality control, business, performance, quality, team, capacity, lean, production, microsoft","collaboration, feedback, organizational skills, customer, team, analytical",lean,Unknown,Unknown,"system, control"
3367,24,"change management, strategic, operations, daily, oracle, operational, performance, erp, team, data, communication, efficiency","analytical thinking, planning, team management, strategic thinking, team, communication",Unknown,Bachelor,Unknown,"system, control, efficiency"
3368,24,"project, operations, time, business, team, communication","responsibility, time, team, communication",Unknown,Unknown,Senior,tracking
3370,24,"communication skills, business, team, reporting","communication skills, team",Unknown,Unknown,Unknown,Unknown
3371,24,"communication skills, risk, project, strategic, reporting, compliance, business, team, process","communication skills, strategic, analytical thinking, customer focus, goal, customer, team, process",Unknown,Unknown,Senior,Unknown
3372,24,"communication skills, process, compliance, demand, business, performance, budget, quality, team, power","communication skills, planning, team, process, analytical",Unknown,Unknown,Unknown,"track, system, tracking"
3374,24,"sap, team, time","team, time",Unknown,Unknown,Unknown,Unknown
3375,24,"performance, team, data, production, communication","attention, feedback, team, analytical, communication",Unknown,Unknown,Unknown,optimization
3376,24,"vendor, strategic, reporting, performance, team, operations management, project, operations, business operations, resource planning, operational excellence, compliance, continuous improvement, operational, project management, communication, process optimization, business, efficiency","strategic, planning, leadership, organizational skills, continuous, team, process, analytical, communication",Unknown,Unknown,Senior,"tracking, optimization, resource, efficiency"
3377,24,"communication skills, project, operations, business, problem solving, performance, team, data, communication","communication skills, analytical thinking, planning, leadership, goal, problem solving, responsibility, customer, team, multitasking, communication",Unknown,Unknown,Unknown,Unknown
3378,24,"communication skills, data analysis, operations, daily, business, team, data, communication","communication skills, planning, feedback, goal, team, communication",Unknown,Unknown,Unknown,Unknown
3379,24,"change management, operations, reporting, operational excellence, logistics, continuous improvement, inventory, standard, procurement, budget, team, process, data, project management, production, microsoft","customer, task, continuous, team, process, analytical",Unknown,Unknown,Unknown,"logistics, system, inventory"
3380,24,"demand, standard, team, process, decision","decision, leadership, team, process",Unknown,Unknown,Expert,study
3382,24,"communication skills, operations, daily, continuous improvement, compliance, business, standard, performance, budget, team, data","communication skills, collaboration, responsibility, continuous, attention to detail, team",Unknown,Unknown,Unknown,track
3383,24,"communication skills, kpi, time, daily, logistics, reporting, sap, inventory, business, performance, team, process, report, warehouse, communication","communication skills, resilience, time, customer, responsibility, team, process, communication",Unknown,Unknown,Mid-Level,"kpi, logistics, track, inventory, tracking, control"
3384,24,"daily, project, team","organizational, team",Unknown,Unknown,Entry Level,"system, optimization"
3385,24,"communication skills, supply, compliance, continuous improvement, sap, business, erp, continuous, team, process, communication","communication skills, initiative, customer, continuous, team, process, communication",Unknown,Unknown,Senior,initiative
3386,24,"business, operational",leadership,Unknown,Bachelor,Unknown,Unknown
3387,24,"communication skills, problem, operations, time, reporting, logistics, decision making, inventory, business, performance, problem solving, quality, team, warehouse, production","communication skills, problem, time, planning, decision making, leadership, customer, responsibility, problem solving, team management, team",Unknown,Unknown,Senior,"logistics, system, inventory"
3388,24,"strategic, supply, operations, project, logistics, cost, business, operational, standard, quality, team, process, project management, communication","strategic, critical thinking, leadership, customer, team management, team, process, communication",Unknown,Unknown,Intern,"cost, logistics, system, tracking"
3389,24,"microsoft, operations, time, reporting, business, operational, problem solving, quality, team, data, decision, communication","collaboration, time, planning, customer, problem solving, attention to detail, team, decision, communication",Unknown,Unknown,Unknown,"system, control, tracking"
3390,24,"strategic, operations, business, project management, communication","strategic, communication, negotiation",Unknown,Unknown,Senior,track
3391,24,"communication skills, operations, daily, budget, team","communication skills, team",Unknown,Unknown,Senior,system
3392,24,"supply, daily, logistics, sap, business, warehouse, production, communication","responsibility, planning, analytical, communication",Unknown,Unknown,Unknown,"logistics, system, control"
3393,24,"project, operations, reporting, business, performance, time management, team, data, project management, communication","goal, responsibility, time management, team, communication",Unknown,Unknown,Unknown,optimization
3394,24,"communication skills, business, team","communication skills, analytical thinking, planning, organizational, team",Unknown,Unknown,Unknown,Unknown
3395,24,"communication skills, strategic, project, reporting, microsoft, business, quality, team, data, communication","accountability, communication skills, strategic, collaboration, initiative, attention to detail, team, analytical, communication",Unknown,Unknown,Unknown,initiative
3396,24,"data analysis, strategic, operations, business, operational, quality, team, project management, efficiency","strategic, collaboration, multitask, feedback, planning, goal, organizational, team",Unknown,Unknown,Unknown,efficiency
3398,24,"logistics, warehouse, warehouse operations",Unknown,Unknown,Unknown,Unknown,logistics
3399,24,"project, supply, time, cost, cost reduction, inventory, team, process, data, decision, project management, efficiency","time, critical thinking, planning, initiative, leadership, responsibility, team, process, decision",Unknown,Unknown,Senior,"reduction, cost, initiative, inventory, control, efficiency"
3400,24,"process, operations, supply, logistics, compliance, cost, sap, performance, budget, quality, team, power, microsoft","responsibility, team, process",Unknown,Unknown,Unknown,"logistics, cost, control"
3401,24,"data analysis, operations, reporting, quality control, compliance, business, quality, team, process, report, production","feedback, planning, leadership, customer, team, process",Unknown,Unknown,Unknown,"system, control"
3402,24,"communication skills, operations, reporting, daily, change, supply, business, operational, performance, inventory, budget, quality, team, daily operations, project management, communication","communication skills, stakeholder, team, communication",Unknown,Bachelor,Mid-Level,"track, inventory"
3403,24,"process mapping, cost, continuous improvement, business, quality, team, process","organizational, continuous, team, process, analytical",Unknown,Unknown,Unknown,"cost, system"
3404,24,"process, team, time","responsibility, process, team, time",Unknown,Unknown,Unknown,Unknown
3405,24,"communication skills, problem, project, operational, performance, data","communication skills, problem, customer",Unknown,Bachelor,Intern,"system, control, tracking"
3406,24,"logistics, resource, operational, efficiency, inventory control, process, warehouse, production, microsoft","accountability, attention to detail, process",Unknown,Unknown,Unknown,"logistics, inventory, resource, control, efficiency"
3407,24,"project, supply, operations, change, logistics, reporting, cost, business, resource, procurement, quality, team, process, data, communication, efficiency","planning, initiative, organizational skills, customer, team, process, communication",Unknown,Unknown,Senior,"logistics, cost, initiative, system, resource, efficiency"
3408,24,"communication skills, time, change, business, operational, quality, team, process, power","communication skills, collaboration, time, professionalism, team, process, analytical",Unknown,Unknown,Senior,tracking
3410,24,"microsoft, operations, time, business, quality, team, data, communication","time, attention, feedback, initiative, customer, team, communication",Unknown,Unknown,Senior,"initiative, control"
3412,24,"risk, time, daily, logistics, business, resource, performance, team, process, report, production, communication, microsoft","time, initiative, task, team, process, communication",Unknown,Bachelor,Senior,"reduction, logistics, system, initiative, resource, tracking, control"
3413,24,"project, reporting, business, operational, erp, continuous, team, process, power bi, microsoft","collaboration, customer, responsibility, stakeholder, continuous, team, process, analytical",Unknown,Unknown,Senior,system
3414,24,"communication skills, operations, time, kpi, logistics, reporting, supply, sap, operational, warehouse operations, erp, team, process, inventory management, inventory control, warehouse","communication skills, time, planning, team, process, analytical",Unknown,Unknown,Senior,"kpi, logistics, system, inventory, tracking, control"
3415,24,"communication skills, reporting, cost, business, standard, operational, budget, quality, inventory management","planning, communication skills",Unknown,Unknown,Senior,"cost, inventory, control, tracking"
3416,24,"communication skills, team","adaptability, communication skills, professionalism, team",Unknown,Unknown,Unknown,Unknown
3417,24,"project, strategic, reporting, time, compliance, business, performance, data, communication","time, strategic, communication",Unknown,Unknown,Senior,Unknown
3418,24,"compliance, business, inventory, problem solving, process, power, communication","planning, problem solving, process, analytical, communication",Unknown,Unknown,Senior,"inventory, control, tracking"
3419,24,"daily, production, team",team,Unknown,Unknown,Mid-Level,Unknown
3420,24,"communication skills, operations, team, process, data","communication skills, feedback, initiative, customer, team, process",Unknown,Unknown,Senior,"system, initiative, tracking"
3422,24,"communication skills, project, time, daily, cost, business, quality, team, power","communication skills, time, analytical thinking, organizational skills, team",Unknown,Unknown,Senior,cost
3423,24,"risk, business, six, quality, team","leadership, initiative, critical, responsibility, team",Unknown,Unknown,Senior,initiative
3424,24,"business, budget, quality, team, process, data","attention, task, team, process",Unknown,Unknown,Senior,"system, tracking"
3425,24,"communication skills, operations, supply, reporting, business, operational, performance, quality, team, performance monitoring, communication","communication skills, collaboration, adaptability, organizational skills, goal, attention to detail, team, analytical, communication",Unknown,Unknown,Unknown,Unknown
3426,24,"supply, daily, inventory, problem solving, procurement, team, workflow, communication skills, operations, root, operational, project management, communication, data analysis, logistics, quality control, business, process, data, efficiency","communication skills, collaboration, problem solving, workflow optimization, customer, team, process, communication",Unknown,Unknown,Unknown,"optimization, logistics, system, inventory, workflow, control, efficiency"
3427,24,"communication skills, operational performance, operations, supply, daily, logistics, time, business, operational, problem solving, team, process, data, communication, microsoft","communication skills, time, customer focus, planning, critical, initiative, problem solving, customer, team, process, analytical, communication",Unknown,Unknown,Junior,"logistics, initiative, planner"
3428,24,"communication skills, data analysis, problem, operations, reporting, change, time, compliance, cost, operational, performance, time management, continuous, team, communication","communication skills, problem, time, leadership, planning, feedback, responsibility, time management, continuous, team, communication",Unknown,Unknown,Unknown,"cost, optimization, tracking"
