id,category_id,technical_requirements,soft_skills,domain_knowledge,education_requirement,experience_level,project_experience
1254,11,"c, signal processing, signal, sensor, simulation, control, control systems","discipline, communication skills, project, teamwork, engineering, learning, documentation",Unknown,Bachelor,Unknown,"project, system, signal, processing, sensor, integration, process"
1255,11,"c, noise, debugging, hardware design, prototyping, hardware, power, control, control systems","time, debugging, engineering, testing, safety, precision, documentation, communication",Unknown,Unknown,Unknown,"prototyping, system"
1256,11,i2c,"problem, teamwork, engineering, documentation, communication",Unknown,Unknown,Junior,"system, integration, process"
1257,11,"hardware, power","project, time, engineering, initiative, technical, continuous, communication",Unknown,Unknown,Senior,project
1258,11,power,"project, engineering, planning, testing, technical",Unknown,Unknown,Senior,"project, process"
1259,11,Unknown,"communication skills, creative, analytical thinking, teamwork, engineering, problem solving, learning, continuous, analytical",Unknown,Unknown,Senior,Unknown
1260,11,"c, simulink, signal processing, matlab, power, simulation, control, control systems","project, engineering, technical, task, documentation",Unknown,Unknown,Unknown,"project, system, signal, processing, unit, process"
1261,11,"power electronics, control systems","communication skills, creative, project, analytical thinking, teamwork, engineering, problem solving, testing, technical, communication",Unknown,Unknown,Senior,"system, project"
1263,11,"matlab, digital","engineering, initiative, communication",Unknown,PhD,Unknown,system
1264,11,"control, assembly","project, communication, time",Unknown,Unknown,Senior,project
1265,11,"simulation, matlab, signal processing, control","technical, engineering, planning, communication",Unknown,Master,Unknown,"system, integration, signal, processing"
1266,11,"matlab, simulink, control, control systems","systematic, engineering, testing, troubleshooting, planning skills, communication",Unknown,Unknown,Unknown,system
1267,11,"analog, hardware test, ltspice, simulation, hardware design","project, engineering, planning, technical, documentation, communication",Unknown,Unknown,Mid-Level,"system, project"
1269,11,Unknown,Unknown,Unknown,PhD,Unknown,Unknown
1270,11,Unknown,"technical, engineering, communication skills, time",Unknown,Unknown,Unknown,Unknown
1271,11,"digital, control, power","accountability, communication skills, time, engineering, focus, safety, responsibility, continuous, learning, logical, communication",Unknown,Bachelor,Junior,system
1272,11,"control, power","collaboration, attention, engineering, testing, communication",Unknown,Unknown,Entry Level,Unknown
1273,11,Unknown,"communication skills, project, engineering, planning, responsibility, technical, learning, continuous",Unknown,Master,Unknown,project
1274,11,digital,"project, engineering, technical, continuous, learning, documentation",Unknown,Unknown,Senior,project
1275,11,"analog, digital","time, engineering, problem solving, technical, learning, continuous, logical, communication",Unknown,Unknown,Entry Level,"system, process"
1277,11,control,"project, collaboration, time, engineering, planning, safety, technical, documentation, communication",Unknown,Bachelor,Unknown,"system, project"
1278,11,"simulation, control systems","accountability, communication skills, project, engineering, continuous improvement, safety, technical, troubleshooting, learning, communication",Unknown,Unknown,Senior,"system, project, process"
1279,11,"c, noise, debugging, hardware design, prototyping, hardware, power, control, control systems","time, debugging, engineering, testing, safety, precision, documentation, communication",Unknown,Unknown,Unknown,"prototyping, system"
1280,11,"altium, circuit design, fpga, pcb layout, hardware, simulation, hardware design","time, teamwork, engineering, analytical thinking, problem solving, technical, time management, safety, learning, documentation, communication",Unknown,Bachelor,Senior,"pcb, system, integration, process"
1281,11,"pcb design, altium, digital, vhdl, analog, power, circuit, hardware design","engineering, initiative, testing",Unknown,Unknown,Unknown,"unit, pcb"
1282,11,"c, altium, kicad, sensor, pcb, power, schematic, hardware design","project, collaboration, attention, engineering, testing",Unknown,Unknown,Senior,"project, system, sensor, coding, integration, pcb"
1283,11,"control, hardware design","engineering, communication skills",Unknown,Unknown,Mid-Level,process
1284,11,sensor,"analytical thinking, engineering, problem solving, technical, task, communication",Unknown,Unknown,Senior,"system, sensor, integration, processing"
1285,11,"pcb design, spi, pcb, assembly","teamwork, analytical thinking, engineering, technical, documentation",Unknown,Unknown,Mid-Level,"pcb, process"
1286,11,"control, power","teamwork, analytical thinking, engineering, continuous improvement, planning, safety, technical, documentation",Unknown,Unknown,Senior,"system, process"
1287,11,"embedded, logic, embedded systems, signal processing, fpga, debugging, verilog, prototyping, digital, analog, hardware, serial, simulation, circuit, control","communication skills, debugging, time, engineering, initiative, focus, safety, technical, learning, documentation",Unknown,Unknown,Senior,"embedded, prototyping, signal, processing, process"
1288,11,"pcb design, altium designer, multisim, power, control systems, hardware test, pcb, hardware, simulation, schematic, hardware design","project, teamwork, analytical thinking, engineering, problem solving, responsibility, technical, documentation",Unknown,Unknown,Senior,"system, integration, project, pcb"
1289,11,"digital, hardware, power, control, hardware design","project, adaptability, engineering, technical, logical, communication",Unknown,Unknown,Mid-Level,"system, project"
1290,11,"embedded, device, hardware testing, c programming, hardware","testing, continuous, learning, time",Unknown,Unknown,Unknown,"embedded, process"
1291,11,"control systems, control, power","technical, engineering",Unknown,Unknown,Senior,"system, integration"
1292,11,"altium designer, embedded linux, i2c, spi, uart, prototyping, digital, analog, hardware, pcb, circuit, oscilloscope, hardware design","project, analytical thinking, time, engineering, planning, documentation, communication",Unknown,Unknown,Senior,"prototyping, embedded, project, pcb"
1293,11,Unknown,"project, communication",Unknown,Unknown,Senior,project
1294,11,"schematic, matlab, digital, power, simulation, control","discipline, project, time, teamwork, engineering, planning, testing, technical, problem solving, attention to detail, technical communication, communication",Unknown,Bachelor,Mid-Level,"system, project, integration, process"
1295,11,power,"project, teamwork, engineering, planning, technical, communication",Unknown,Unknown,Unknown,"system, project, integration"
1296,11,"altium, circuit design, fpga, digital, analog, control systems, hardware, power, pcb layout, power electronics, hardware design","engineering, planning, safety, technical, communication",Unknown,Unknown,Junior,"system, pcb, process"
1297,11,Unknown,"communication skills, project, engineering, planning, responsibility, technical, learning, continuous",Unknown,Master,Unknown,project
1298,11,control,"project, safety, communication",Unknown,Unknown,Senior,"system, project, process"
1299,11,"device, hardware, power, control, control systems","project, creative, time, engineering, focus, technical, continuous, communication",Unknown,Unknown,Unknown,"system, project"
1300,11,"digital, control, power","project, collaboration, time, engineering, planning, safety, technical, responsibility",Unknown,Bachelor,Entry Level,"system, project, process"
1301,11,"altium designer, embedded, fpga, debugging, matlab, digital, hardware, assembly, arm, schematic, pcb design, spi, hardware design, microprocessors, pcb, power, i2c, serial, uart, circuit design, microcontrollers, signal, vhdl, ltspice, circuit, oscilloscope","communication skills, debugging, engineering, initiative, testing, responsibility, task, analytical, communication",Unknown,Unknown,Unknown,"embedded, process, system, signal, integration, pcb"
1302,11,control,"technical, engineering, project, teamwork",Unknown,Unknown,Unknown,project
1303,11,circuit,"systematic, project, teamwork, time, engineering, initiative, testing, technical",Unknown,Unknown,Mid-Level,project
1304,11,device,"communication skills, teamwork, analytical thinking, engineering, problem solving, responsibility, task, communication",Unknown,Unknown,Unknown,Unknown
1305,11,"pcb design, i2c, spi, uart, fpga, circuit design, altium, oscilloscope, analog, ltspice, hardware, pcb, schematic, hardware design","project, teamwork, analytical thinking, engineering, problem solving, technical, time management, safety, learning, communication",Unknown,Bachelor,Senior,"pcb, system, project, integration"
1306,11,"circuit, assembly","creative, engineering, continuous improvement, responsibility, technical, continuous",Unknown,Unknown,Senior,process
1307,11,"signal processing, matlab, digital, hdl, vhdl, analog, hardware, hardware design","engineering, initiative, communication",Unknown,Unknown,Unknown,"unit, signal, processing"
1308,11,"logic, analog, power, simulation, oscilloscope, hardware design","teamwork, analytical thinking, engineering, problem solving, technical",Unknown,Unknown,Unknown,Unknown
1309,11,matlab,"technical, engineering, communication",Unknown,Unknown,Unknown,"system, integration"
1311,11,c,"engineering, testing, teamwork",Unknown,Unknown,Senior,integration
1312,11,"embedded, logic, fpga, debugging, digital, signal, analog, pcb layout, pcb, power, serial, hardware, hardware design","communication skills, collaboration, debugging, time, engineering, safety, testing, technical, learning, continuous",Unknown,Unknown,Senior,"embedded, system, signal, pcb, process"
1313,11,"control, assembly","technical, engineering, planning",Unknown,Unknown,Unknown,unit
1314,11,control,"project, time, engineering, problem solving, technical, planning skills, communication",Unknown,Unknown,Senior,project
1315,11,"embedded, embedded c, simulink, matlab, microcontrollers, power, peripherals, debugging tools, power electronics, control, embedded software","project, collaboration, debugging, attention, engineering, communication",Unknown,PhD,Senior,"embedded, project, integration"
1316,11,Unknown,"engineering, communication skills, time",Unknown,Unknown,Senior,Unknown
1317,11,"altium designer, embedded, logic, digital, microcontrollers, signal, analog, pcb layout, hardware, power, pcb, simulation, hardware design","engineering, testing, technical, documentation, communication",Unknown,Unknown,Senior,"signal, embedded, system, pcb"
1318,11,arm,"technical, engineering, analytical",Unknown,Unknown,Unknown,process
1319,11,power,"project, analytical thinking, engineering, planning, technical, communication",Unknown,Unknown,Unknown,"project, integration"
1320,11,"control, power","engineering, continuous improvement, safety, technical, continuous",Unknown,Unknown,Unknown,"system, process"
1321,11,"c, digital, power, simulation, control","discipline, project, time, engineering, planning, focus, testing, technical, problem solving, continuous, learning, documentation, analytical, communication",Unknown,Unknown,Unknown,"system, project, integration, process"
1322,11,"logic, control systems","communication skills, project, engineering, testing, technical, safety, documentation",Unknown,Unknown,Unknown,"project, process"
1323,11,"circuit, power","teamwork, analytical thinking, engineering, continuous improvement, time, safety, technical",Unknown,Unknown,Senior,"system, process"
1324,11,"c, matlab, firmware, hardware, power, simulation, control, control systems","communication skills, project, engineering, testing, technical, troubleshooting",Unknown,Bachelor,Senior,"project, system, firmware, integration, process"
1325,11,Unknown,"responsibility, communication, testing",Unknown,Unknown,Unknown,"system, process"
1326,11,power,"project, teamwork, time, engineering, focus, problem solving, technical, learning, communication",Unknown,Unknown,Senior,"project, integration, process"
1327,11,"hardware, power","planning, safety, technical, troubleshooting, testing, documentation",Unknown,Unknown,Mid-Level,"system, process"
1328,11,"fpga, signal processing, matlab, digital, gpio, hardware, spi, simulation, rtos, verilog, logic, bootloader, zephyr, i2c, serial, adc, embedded linux, uart, dac, hdl, microcontrollers, signal, vhdl, oscilloscope","project, teamwork, analytical thinking, engineering, problem solving, technical, time management, safety, learning, documentation, communication",Unknown,Bachelor,Senior,"embedded, project, system, signal, processing, unit, integration, process"
1329,11,"altium, power, simulation, circuit, power electronics, control","engineering, time, project, communication",Unknown,Bachelor,Unknown,"project, integration"
1331,11,power,"communication skills, project, teamwork, analytical thinking, engineering, technical",Unknown,Unknown,Senior,project
1332,11,"c, digital","communication skills, project, analytical thinking, teamwork, engineering, problem solving, continuous, learning",Unknown,Unknown,Mid-Level,project
1333,11,power,"communication skills, project, engineering, planning, safety",Unknown,Unknown,Senior,"unit, project"
1334,11,"matlab, assembly","responsibility, engineering, initiative",Unknown,Unknown,Unknown,"system, integration"
1335,11,"control, digital, hardware, control systems","teamwork, engineering, focus, technical, troubleshooting, task, communication",Unknown,Unknown,Unknown,"unit, system, process"
1336,11,"pcb design, embedded, spi, uart, digital, analog, hardware, i2c, serial","problem, teamwork, safety, responsibility, testing, technical, continuous, learning, communication",Unknown,Bachelor,Intern,"embedded, pcb, process"
1337,11,"power, assembly","technical, engineering, teamwork",Unknown,Unknown,Mid-Level,system
1338,11,"circuit, power electronics, control, power","communication skills, project, engineering, planning, testing, technical, safety",Unknown,Bachelor,Senior,"system, project, integration"
1339,11,"embedded, debugging, analog, hardware, power, simulation, schematic","collaboration, debugging, technical, documentation, communication",Unknown,Unknown,Senior,"embedded, system, processing"
1340,11,"control, digital, hardware, hardware design","project, engineering, testing, technical, learning",Unknown,Unknown,Unknown,project
1341,11,power,"communication skills, project, analytical thinking, engineering, planning, technical",Unknown,Unknown,Unknown,project
1342,11,Unknown,"time management, communication skills, planning, teamwork",Unknown,Unknown,Senior,Unknown
1343,11,Unknown,Unknown,Unknown,Unknown,Mid-Level,Unknown
1344,11,"simulink, matlab, digital, simulation, control, control systems","communication skills, project, teamwork, engineering, focus, technical, communication",Unknown,Unknown,Unknown,"system, project, integration, process"
1345,11,"control, control systems","discipline, problem, project, engineering, responsibility, technical, troubleshooting, analytical",Unknown,Bachelor,Unknown,"unit, system, project"
1346,11,"digital, control","communication skills, logical, testing, technical, troubleshooting, documentation, analytical, communication",Unknown,Unknown,Senior,system
1347,11,control,"teamwork, project, problem solving",Unknown,Unknown,Senior,project
1348,11,Unknown,"project, collaboration, time, attention, engineering, planning, focus, safety, technical, analytical",Unknown,Unknown,Senior,project
1349,11,"pcb design, altium designer, hardware validation, circuit design, prototyping, signal, pcb, power, simulation, hardware, circuit, power electronics, schematic, hardware design","project, collaboration, engineering, documentation, communication",Unknown,Unknown,Unknown,"project, prototyping, signal, pcb, process"
1350,11,"digital, assembly","technical, engineering, time",Unknown,Unknown,Unknown,Unknown
1351,11,"embedded, altium, i2c, circuit design, fpga, spi, control, hardware, power, simulation, pcb, circuit, power electronics, schematic","responsibility, engineering, initiative, communication",Unknown,Unknown,Senior,"embedded, system, pcb, process"
1352,11,assembly,"engineering, problem solving, responsibility, analytical, communication",Unknown,Bachelor,Unknown,Unknown
1353,11,"simulation, hardware","project, teamwork, analytical thinking, engineering, problem solving, technical, time management, safety, learning, documentation, communication",Unknown,Bachelor,Senior,"system, project, integration, process"
1354,11,"c, signal processing, prototyping, matlab, signal, power","project, teamwork, engineering, planning, technical, communication",Unknown,Bachelor,Senior,"project, prototyping, system, signal, processing, coding, integration, process"
1356,11,device,"communication skills, project, engineering, continuous improvement, initiative, technical, attention to detail, analytical, communication",Unknown,Unknown,Mid-Level,"system, project, integration"
1357,11,"control, power, assembly","engineering, safety, teamwork",Unknown,Unknown,Senior,system
1358,11,"embedded, debugging, analog, hardware, power, simulation, schematic","collaboration, debugging, technical, documentation, communication",Unknown,Unknown,Senior,"embedded, system, processing"
1359,11,"digital, control, hardware design","project, engineering, testing, technical, learning",Unknown,Unknown,Unknown,project
1360,11,"simulink, digital, simulation, control, control systems","communication skills, project, teamwork, engineering, focus, technical, communication",Unknown,Unknown,Unknown,"system, project, integration, process"
1362,11,control,"project, collaboration, time, engineering, planning, focus, safety, technical, testing, responsibility, documentation, analytical",Unknown,Unknown,Unknown,project
1364,11,"altium designer, embedded, debugging, digital, firmware, analog, hardware, assembly, power electronics, schematic, control, pcb design, spi, prototyping, schematic capture, pcb layout, embedded software, hardware design, logic, power, i2c, uart, circuit design, microcontrollers, signal","accountability, collaboration, debugging, teamwork, engineering, continuous improvement, safety, testing, technical, documentation, analytical, communication",Unknown,Unknown,Senior,"embedded, prototyping, system, signal, firmware, pcb"
1365,11,Unknown,"project, engineering, technical, responsibility, continuous, learning",Unknown,Master,Unknown,"project, process"
1366,11,"control, debugging","responsibility, testing, technical, debugging",Unknown,Unknown,Unknown,Unknown
1367,11,"control, power, hardware, control systems","systematic, project, collaboration, engineering, continuous improvement, safety, technical",Unknown,Unknown,Mid-Level,"processing, project, process"
1368,11,control,"communication skills, project, time, teamwork, engineering, responsibility, communication",Unknown,Unknown,Unknown,"system, project, process"
1370,11,"embedded, i2c, spi, circuit design, fpga, altium, control, eeprom, hardware, power, simulation, pcb, circuit, schematic","responsibility, engineering, initiative, communication",Unknown,Unknown,Senior,"embedded, system, pcb, process"
1371,11,Unknown,"communication skills, project, collaboration, engineering, planning, continuous, learning",Unknown,Unknown,Senior,"project, process"
1372,11,Unknown,"communication skills, project, time, teamwork, engineering, technical, responsibility, communication",Unknown,Bachelor,Unknown,"system, project"
1373,11,"debugging, c, power","project, creative, resilience, debugging, engineering, analytical thinking, focus, technical, responsibility, learning, communication",Unknown,Master,Mid-Level,"system, project, integration, process"
1374,11,"c, digital, power","project, creative, collaboration, engineering, focus, technical, responsibility, troubleshooting, learning, communication",Unknown,Master,Unknown,"system, project, integration, process"
1375,11,"c, control, power","problem, project, creative, analytical thinking, engineering, continuous improvement, problem solving, technical, responsibility, learning, continuous, communication",Unknown,Master,Unknown,"system, project, integration, process"
1376,11,"c, power","discipline, project, creative, engineering, technical, responsibility, troubleshooting, learning, communication",Unknown,Master,Unknown,"system, project, integration, process"
1377,11,control,"communication skills, teamwork, analytical thinking, engineering, planning, problem solving, task",Unknown,Unknown,Senior,Unknown
1378,11,"noise, signal, pcb, power, simulation, circuit, hardware design","responsibility, engineering, communication",Unknown,Unknown,Mid-Level,"signal, system, pcb"
1382,11,assembly,"analytical thinking, engineering, problem solving, technical, continuous",Unknown,Unknown,Senior,process
1383,11,control,"engineering, planning, project, documentation",Unknown,Unknown,Senior,project
1384,11,"altium designer, digital, signal, hardware, power, circuit, hardware design","engineering, task, communication",Unknown,Unknown,Mid-Level,signal
1385,11,matlab,"technical, engineering",Unknown,Unknown,Unknown,"system, integration"
1386,11,digital,"engineering, planning, focus, testing, technical, troubleshooting, continuous, learning, analytical",Unknown,Unknown,Unknown,"unit, system, integration"
1387,11,c,"engineering, planning, documentation, communication",Unknown,Unknown,Unknown,system
1388,11,"pcb design, c, embedded systems, hardware design, hardware test, hardware, circuit, control systems",engineering,Unknown,Unknown,Unknown,"embedded, system, pcb"
1390,11,"control, hardware, control systems","technical, engineering, problem, communication",Unknown,Unknown,Mid-Level,"unit, system, integration"
1392,11,"power electronics, hardware","technical, engineering, problem, communication",Unknown,Unknown,Mid-Level,"unit, system"
1393,11,"debugging, analog, power, simulation, schematic","collaboration, debugging, technical, documentation, communication",Unknown,Unknown,Senior,system
1394,11,"embedded, logic, digital, signal, analog, hardware, power, verilog","communication skills, project, planning, responsibility, technical",Unknown,Unknown,Unknown,"embedded, project, system, signal, processing"
1395,11,"embedded, digital, analog, hardware, power","technical, engineering, documentation, collaboration",Unknown,Unknown,Entry Level,"embedded, system, processing"
1399,11,control,"project, collaboration, attention, engineering, testing, technical, documentation, communication",Unknown,Unknown,Unknown,"project, process"
1400,11,control,"communication skills, project, collaboration, attention, testing, technical, analytical",Unknown,Unknown,Unknown,project
1401,11,"circuit, logic, control","communication skills, project, attention, engineering, technical, logical, communication",Unknown,Unknown,Unknown,"project, integration"
1402,11,"debugging, analog, power, simulation, schematic","collaboration, time, debugging, technical, documentation, communication",Unknown,Unknown,Senior,system
1403,11,"prototyping, signal processing, signal","engineering, planning, communication",Unknown,Bachelor,Unknown,"prototyping, system, signal, processing, integration, process"
1404,11,"pcb design, fpga, debugging, digital, signal, pcb, power, serial, embedded software, hardware, circuit, hardware design","debugging, engineering, technical, documentation, communication",Unknown,Unknown,Unknown,"embedded, signal, unit, pcb, process"
1407,11,Unknown,"project, engineering, planning, technical, responsibility, continuous, communication",Unknown,Master,Mid-Level,project
1408,11,"pcb design, altium designer, spi, uart, circuit design, fpga, signal processing, digital, dac, analog, hardware, adc, simulation, circuit, orcad, hardware design","engineering, task, time, communication",Unknown,Unknown,Senior,"system, signal, processing, pcb, process"
1409,11,"pcb design, altium designer, spi, fpga, digital, dac, signal, analog, ltspice, pcb, adc, simulation, hardware, circuit, schematic, hardware design","technical, engineering, project, communication",Unknown,Unknown,Mid-Level,"project, system, signal, pcb, process"
1411,11,"prototyping, signal processing","analytical thinking, engineering, planning, problem solving, technical, task, communication",Unknown,Unknown,Senior,"prototyping, system, signal, processing, integration, process"
1412,11,Unknown,"engineering, communication",Unknown,Unknown,Unknown,system
1413,11,digital,"engineering, planning, task, problem solving",Unknown,Unknown,Unknown,Unknown
1425,12,"python, jenkins, linux, system, performance, new, git, infrastructure","reliability, engineering, planning, system, customer, technical, process",Unknown,Unknown,Senior,system
1434,12,"python, high, automation, cloud, distributed, performance, new","collaboration, engineering, feedback, technical, learning",Unknown,Bachelor,Unknown,Unknown
1439,12,"python, jenkins, terraform, metrics, monitor, cloud, kubernetes, operational, aws, container, devops, bash, ansible, infrastructure as code, azure, docker, git, infrastructure","communication skills, engineering, technical, process, documentation, analytical",Unknown,Unknown,Unknown,documentation
1444,12,"site, distributed, incident management, site reliability engineering, new","reliability, project, resilience, time, engineering, critical, incident",Unknown,Unknown,Senior,"incident, resilience, tool"
1449,12,"monitoring, site",Unknown,Unknown,Unknown,Senior,Unknown
