id,category_id,technical_requirements,soft_skills,domain_knowledge,education_requirement,experience_level,project_experience
1,1,"c, design, software engineer, oop, build, computer, design patterns, software, code, java, full, test, software architecture, software engineering, command, programming","collaboration, collaborative, feedback, active, learning, work, peer",unknown,bachelor,junior,"test, develop, code, development "
2,1,"full, software, application, agile, software development","learning agility, mentoring, time, learning, agile",unknown,bachelor,unknown,"develop, development, application"
3,1,"design, software engineering, build, computer, cloud, redis, backend, full, aws, go, nosql, devops, data, github, programming","creativity, feedback, critical, learning, work",unknown,unknown,unknown,unknown
4,1,"python, software applications, software engineer, mongodb, redis, full, code, web, postgresql, go, javascript, database, software development, programming","problem, communication skills, creativity, project, growth, initiative, written, work, verbal","network, testing",unknown,junior,"web, code, development, testing"
5,1,"c, design, oop, security, performance, github, documentation, computer, system, software, backend, deployment, devops, azure, programming, software development, git, software developer, code, cloud, version control, frontend, software architecture, frontend development, modular, data","initiative, written, work, documentation, independent","version control systems, testing",master,unknown,"development, system, code, testing, deployment, develop, refactor"
6,1,"computer, software, application","responsibility, work",unknown,bachelor,junior,"develop, development, application"
7,1,"design, cloud, build, security, software, performance, data","accountability, growth mindset, problem solving, responsibility, flexibility, learning, active listening, analytical, verbal, creativity, critical thinking, initiative, work, communication, emotional, teamwork, written communication, presentation skills, growth, feedback, client, empathy, active, curiosity",unknown,bachelor,junior,development
8,1,"python, c, computer, code, java, go, javascript, coding, swift","flexibility, work, client",unknown,unknown,unknown,"code, development"
9,1,"c, software developer, system, code, web, performance, javascript, coding, integration, database, sql, documentation, programming","work, documentation",unknown,unknown,mid-level,"web, system, code, development"
10,1,"c, software engineer, computer, code, software engineering, programming","work, teamwork",testing,unknown,junior,"code, develop, development, testing"
11,1,"python, c, design, system, computer, software, code, java, programming","attention, growth, flexibility, written, verbal",network,phd,unknown,"develop, system, code, development"
12,1,"computer, system, security, application","growth, communication",unknown,unknown,unknown,"system, development, application"
13,1,"design, typescript, build, version control, css, backend, performance, web, frontend, code, javascript, troubleshoot, functional, app, deployment, git, rest","communication skills, work","performance optimization, version control systems, testing",unknown,unknown,"development, code, testing, web, deployment, develop, automated, rest"
16,1,"full, system, software, security, application, continuous, data","growth, work, communication",network,bachelor,unknown,"system, development, application"
18,1,"c, design, debugging, build, computer, design patterns, software, java, unit, application, web, programming, data, command, documentation, software development","project, debugging, time, growth, critical, flexibility, learning, work, documentation, communication",network,phd,mid-level,"development, application, web, develop, implementation, framework"
20,1,"data, continuous, documentation","communication skills, project, collaboration, collaborative, growth, time management, learning, work, documentation, analytical",unknown,phd,unknown,"develop, framework, development, implementation"
21,1,"c, design, performance, test, github, software development, programming","creativity, written communication, critical, feedback, task, attention to detail, work, analytical",unknown,unknown,mid-level,"test, develop, development"
22,1,"c, software engineer, computer, software, java, sql, programming","communication skills, project, analytical thinking, work, negotiation",unknown,unknown,junior,unknown
23,1,"c, design, java, database, sql, computer, software, javascript, software development, programming, data structures, software developer, code, web, source, algorithms, application, agile, data","problem, collaboration, time, teamwork, organization, responsibility, learning, agile, work, analytical",unknown,master,unknown,"development, code, application, web, develop"
24,1,"c, application development, software, api, application, test, software development",work,network,bachelor,junior,"test, api, development, application"
25,1,"c, cloud services, design, unit testing, web services, security, performance, docker, sql, computer, test automation, software, backend, nosql, aws, javascript, continuous, azure, programming, git, software development, software developer, google, code, coding, containerization, cloud, version control, troubleshoot, frontend, application, restful apis, backend development, agile, continuous integration, data, scrum","communication skills, analytical thinking, time, collaborative, feedback, active, learning, agile, written, work, scrum, communication, verbal","testing methodologies, version control systems, testing",unknown,junior,"development, code, testing, web, application, test, automated"
26,1,"c, design, computer, version control, full, git","communication skills, creativity, collaboration, feedback, problem solving, learning",version control systems,unknown,unknown,unknown
29,1,"build, full, software, test, data","collaborative, feedback, learning, work, analytical",unknown,bachelor,junior,"test, develop, development"
30,1,"app development, design, build, integration, data","learning, work",unknown,unknown,unknown,"develop, development"
31,1,"system, software, computer programming, application, agile, data, programming","initiative, problem solving, responsibility, task, agile, communication",unknown,unknown,unknown,"system, application"
33,1,"c, software engineer, oop, deploy, design patterns, software, code, java, integration, programming","work, teamwork",unknown,unknown,unknown,"deploy, code, development"
51,1,"python, c, shell, matlab, php, java, swift, sql, typescript, html, computer, javascript, code, go, test, coding, functional, ruby, application, rust, data","flexibility, work, client",unknown,unknown,unknown,"test, code, development, application"
53,1,"design, cloud, postgresql, java, aws, javascript, sql, rest",unknown,unknown,unknown,unknown,rest
54,1,"design, typescript, build, computer, css, api, software, frontend, web, test, javascript, coding, unit testing","communication skills, client, written, work, independent, communication",testing,unknown,unknown,"development, api, testing, web, test, develop"
56,1,"c, web services, mongodb, version control, kubernetes, software, postgresql, unit, application, javascript, git, docker, software development, programming","analytical thinking, teamwork, problem solving, active, work",version control systems,unknown,unknown,"application, develop, development, web"
57,1,"design, cloud, build, security, software, performance, data","accountability, growth mindset, problem solving, responsibility, flexibility, learning, active listening, analytical, verbal, creativity, critical thinking, initiative, work, communication, emotional, teamwork, written communication, presentation skills, growth, feedback, client, empathy, active, curiosity",unknown,bachelor,junior,development
76,1,"c, html, css, full, software, code, performance, application, unit, troubleshooting, web, backend, functional, frontend, build, sql, scalability","work, time",testing,master,mid-level,"development, code, testing, application, web, automated, framework"
77,1,"github, build, full, postgresql, application, continuous, agile, data, database","collaboration, time, growth, flexibility, learning, agile, work",unknown,unknown,unknown,"development, application"
78,1,"design, debugging, php, security, api, java, performance, database, authentication, sql, docker, software engineer, kubernetes, backend, nosql, aws, javascript, azure, security best practices, web, cloud, frontend, application, troubleshooting, data","learning, work, debugging",performance optimization,unknown,unknown,"development, api, web, application, develop"
79,1,"c, design, debugging, full, software, code, java, aws, microservices, test, unit, performance, functional, application, data, azure, documentation, software development","collaboration, debugging, time, growth, critical, learning, work, documentation",unknown,unknown,unknown,"development, creation, code, application, microservices, test, develop"
80,1,"python, c, design, debugging, algorithms, html, system, software, code, performance, application, test, java, javascript, web, troubleshooting, programming, data structures","project, debugging, teamwork, growth, work, communication","network, testing",unknown,unknown,"development, system, code, testing, application, test, web, develop"
81,1,"python, c, mongodb, algorithms, computer, kubernetes, software, security, web, api, backend, aws, encryption, docker, software development","communication skills, creativity, growth, critical, written, work, communication","network, testing",unknown,unknown,"development, api, testing, web, develop"
82,1,"design, debugging, bitbucket, build, full, system, software, code, frontend, css, frontend development, test, monitoring, deployment, github, git","project, time, debugging, teamwork, growth, learning, work, analytical, communication",testing,bachelor,junior,"development, system, code, testing, test, deployment"
89,1,"python, design, software developer, software applications, oop, debugging, deploy, computer, software, code, application, test, agile, git, source, programming","teamwork, debugging, agile, work, analytical, communication",testing,phd,unknown,"development, deploy, code, testing, application, test, develop"
91,1,"design, application development, integration testing, debugging, computer, software, code, unit, software development, programming","debugging, time, written, work, communication, verbal","network, testing",bachelor,unknown,"development, code, testing, application, develop"
92,1,"design, security, performance, scalability, database, rest, computer, software, postgresql, nosql, aws, continuous, devops, programming, data structures, software development, code, go, test, sprint, algorithms, cloud, build, agile, unit testing, scrum","communication skills, teamwork, time, growth, critical, empathy, responsibility, agile, work, peer, scrum, analytical, communication","agile methodologies, network, testing",master,unknown,"development, code, testing, test, refactoring, automated, rest"
93,1,"python, design, monitor, algorithms, build, computer, backend, performance, frontend, test, monitoring, functional, integration, data, visual, documentation","communication skills, project, time, organization, responsibility, learning, work, documentation, analytical",testing,unknown,unknown,"test, develop, development, testing"
94,1,"test, google, design, rest","creativity, project, adaptability, growth, active, written, work, verbal",unknown,unknown,unknown,"test, rest"
97,1,"design, typescript, deploy, build, security, troubleshoot, code, unit, test, application, aws, jira, api development, confluence, backend development, observability, documentation","collaboration, time, collaborative, feedback, growth, active, work, documentation, communication",unknown,unknown,unknown,"development, deploy, api, code, application, test, develop"
98,1,"design, data, software engineering, cloud, computer, system, frontend, web, java, test, agile, coding, programming, kotlin, swift, software development","creativity, collaboration, teamwork, mentor, agile, work, learning, curiosity, communication",unknown,unknown,junior,"test, system, development, web"
99,1,"python, software engineering, algorithms, build, computer, mysql, software, version control, scala, aws, devops, data, github, programming","time, learning, work, communication",unknown,master,unknown,"implementation, framework, develop, development"
100,1,"python, design, full, computer, code, java, aws, test, troubleshooting, application, data, sql, documentation","communication skills, project, time, growth, presentation skills, work, documentation, analytical",unknown,bachelor,junior,"development, code, application, test, develop, automated"
104,1,"c, design, software engineer, oop, build, computer, design patterns, software, code, java, full, test, software architecture, software engineering, command, programming","collaboration, collaborative, feedback, active, learning, work, peer",unknown,bachelor,junior,"test, code, development"
106,1,"c, design, algorithms, matlab, computer, software, test, functional, integration, programming","collaboration, attention, critical thinking, growth, problem solving, work, communication",network,unknown,unknown,"test, develop, development"
107,1,"c, design, performance, test, data, github, software development, programming","communication skills, creativity, collaboration, collaborative, written communication, critical, feedback, problem solving, task, attention to detail, analytical, communication",unknown,unknown,mid-level,"test, creation, develop, development"
108,1,"python, c, design, software engineer, algorithms, deploy, computer, cloud, google, performance, aws, integration, data, azure, programming","communication skills, project, collaborative, growth, responsibility, learning, mentor, work",unknown,phd,mid-level,"deploy, automated, develop, development"
109,1,"cloud services, design, unit testing, debugging, design patterns, security, performance, app, java, swift, rest, system, kubernetes, backend, aws, continuous, devops, azure, git, code, coding, kotlin, sprint, build, version control, troubleshoot, application, restful apis, data","communication skills, collaboration, debugging, collaborative, growth, active, learning, written, work",testing,unknown,unknown,"development, system, code, application, testing, rest"
110,1,"oop, computer, full, software, design patterns, application, code, restful apis, agile, source, data, software development, git","collaboration, time, teamwork, organization, responsibility, learning, agile, work, analytical",unknown,master,unknown,"code, develop, development, application"
111,1,"python, software engineering, build, computer, cloud, scala, java, test, continuous, coding, data, sql, programming","project, analytical thinking, presentation skills, problem solving, learning, written, communication",unknown,master,junior,"test, develop, development"
112,1,"c, design, application development, build, computer, software, performance, application, test, web, agile, data, command, sql, software applications","communication skills, project, time, adaptability, growth, flexibility, attention to detail, agile, work, learning",testing,unknown,unknown,"development, testing, application, test, web, develop"
113,1,"python, cloud services, design, redis, performance, database, documentation, application development, software engineer, html, computer, full, software, postgresql, aws, javascript, deployment, devops, integration, azure, programming, software development, mongodb, google, code, web, test, go, cloud, css, agile","problem, communication skills, creativity, growth, initiative, attention to detail, written, agile, work, documentation, verbal","network, software development lifecycle, devops practices",unknown,unknown,"development, web application development, code, test, deployment"
114,1,"design, cloud, computer, version, software, jira, git, data, software development","verbal, written, communication",unknown,unknown,unknown,"develop, development"
115,1,"python, design, continuous deployment, shell, design patterns, security, performance, documentation, monitor, software engineer, kubernetes, full, software, microservices, jira, git, software development, code, test, troubleshoot, application, continuous integration, software engineering","communication skills, mentoring, time, organization, feedback, critical, growth, mentor, written, work, learning, documentation, analytical",testing,unknown,mid-level,"development, code, testing, application, test, microservices, deployment, develop, automated"
117,1,"typescript, html, computer, system, css, software, application, frontend, test, security, javascript, git, devops, azure, docker, software development, programming","problem, teamwork, learning, work, analytical, verbal",unknown,bachelor,mid-level,"test, system, development, application"
118,1,"c, design, oop, design patterns, api, database, docker, sql, typescript, computer, system, kubernetes, software, continuous, software development, code, web, containerization, cloud, application, agile, unit testing","learning, agile, work, project",testing,unknown,unknown,"development, system, api, code, testing, web, application"
119,1,"c, oop, software engineer, design patterns, code, java, programming","work, teamwork",testing,unknown,unknown,"code, develop, development, testing"
121,1,"python, data, software engineer, monitor, build, kubernetes, cloud, software, code, computer, application, go, observability, monitoring, test, source","work, learning, project",unknown,unknown,unknown,"development, code, application, test, develop"
123,1,"design, typescript, backend, web, frontend, performance, code, restful apis, unit, integration, git","organization, learning, work",testing,unknown,unknown,"testing, develop, code, web"
127,1,"design, api, performance, typescript, computer, backend, javascript, integration, git, security best practices, code, web, build, css, version control, troubleshoot, frontend, unit, restful apis, application, monitoring, frontend development, agile, data, scalability","feedback, agile, work",version control systems,unknown,unknown,"development, api, code, web, application, develop, implementation, framework"
128,1,"c, version, cloud, test, data, sql, programming","attention, critical, initiative, time management, work, curiosity, analytical, communication",testing,bachelor,unknown,"test, develop, testing"
130,1,"python, oop, algorithms, cloud, kubernetes, code, application, aws, troubleshooting, devops, bash, software engineering, azure, docker, git","project, growth, critical, learning, work",unknown,unknown,junior,"development, develop, code, application"
131,1,"design, design patterns, java, sql, documentation, application development, system, full, software, computer, javascript, integration, command, programming, data structures, mongodb, web, coding, algorithms, cloud, application, backend development, data","time, interpersonal skills, critical thinking, problem solving, responsibility, work, verbal communication, documentation, analytical",unknown,unknown,unknown,"development, system, web application development, application, web, develop, framework"
132,1,"python, c, data, software developer, build, computer, test automation, java, source control, application, web, devops, programming, git, software engineering, command, software development","responsibility, flexibility, attention to detail, learning, work, analytical",unknown,phd,unknown,"development, web, application, test, develop"
133,1,"sql, html, system, test automation, software, backend, computer, javascript, command, programming, google, code, web, go, software lifecycle, coding, build, css, application, frontend development, agile, data","analytical thinking, organization, growth, responsibility, time management, learning, agile, work",testing,unknown,unknown,"development, system, code, testing, web, test, application"
134,1,"c, oop, design patterns, code, java, programming","work, teamwork",testing,unknown,unknown,"code, development, testing"
135,1,"design, oop, redis, design patterns, security, performance, java, software engineer, system, computer, software, backend, aws, programming, code, build, cloud, software architecture, data, scalability","attention to detail, work, stakeholder, time",unknown,unknown,unknown,"system, code, development"
136,1,"c, design, cloud, computer, api, performance, data, programming","work, learning, project, attention to detail",unknown,bachelor,junior,"api, development"
138,1,"design, oop, build, computer, design patterns, version control, code, performance, unit, microservices, system, continuous, agile, coding, swift, continuous integration, integration, git","communication skills, feedback, initiative, mentor, agile, agile mindset","performance optimization, microservices architecture, testing",unknown,unknown,"development, system, code, testing, microservices, develop, framework, refactoring"
139,1,"python, design, typescript, html, css, version control, software, code, web, performance, application, javascript, source, visual, git","communication skills, project, attention to detail, learning, work, curiosity",version control systems,bachelor,unknown,"development, code, application, web, framework"
141,1,"python, design, unit testing, oop, web services, redis, php, security, database, docker, sql, rest api, system, computer, software, backend, kubernetes, nosql, microservices, continuous, programming, software development, git, mysql, code, web, go, build, cloud, version control, monitoring, data",learning,"microservices architecture, version control systems, security principles, testing",unknown,unknown,"development, system, api, code, web, testing, microservices, develop, rest"
143,1,"performance tuning, software engineering, algorithms, cloud, performance, go, observability, monitoring, deployment, data, database, docker, documentation, software development, rest","problem, communication skills, time, attention, collaborative, organization, growth, flexibility, learning, work, documentation, communication","network, testing",unknown,unknown,"development, testing, deployment, automated, framework, rest"
144,1,"c, typescript, html, full, system, restful, code, application, api, css, javascript, api development, integration, authentication, software development","teamwork, initiative, responsibility, learning, work, communication",unknown,unknown,mid-level,"development, system, api, code, application, develop, framework"
145,1,"design, github, typescript, computer, jira, javascript, git, programming, software development, data structures, code, web, coding, algorithms, css, frontend, restful apis, frontend development, agile, data","project, analytical thinking, written communication, growth, feedback, verbal, flexibility, learning, agile, work, communication",testing,unknown,mid-level,"development, code, testing, web, develop, automated"
146,1,"design, application development, software engineering, computer, version control, software, code, app, frontend, troubleshooting, frontend development, programming, integration, source, github, command, software development","critical, task, learning, work, communication",version control systems,unknown,unknown,"code, develop, development, application"
149,1,"python, design, debugging, redis, performance, java, docker, documentation, software engineer, typescript, full, kubernetes, backend, nosql, microservices, aws, continuous, software development, code, web, kotlin, sprint, containerization, build, cloud, restful, troubleshooting, agile, data, scalability","learning agility, collaboration, debugging, time, collaborative, adaptability, critical thinking, project, client, learning, agile, work, stakeholder, documentation, analytical, communication","microservices architecture, testing",unknown,unknown,"development, code, testing, web, microservices, develop, implementation, refactor, framework"
151,1,"c, design, oop, computer, design patterns, full, code, java, software architecture, modular, coding, software engineering, command, programming","communication skills, collaboration, collaborative, feedback, learning, work",unknown,bachelor,unknown,"develop, code, development"
152,1,"data, cloud, computer, system, kubernetes, version control, code, aws, application, monitoring, devops, deployment, software engineering, azure, docker, git","collaborative, growth, learning, work",version control systems,unknown,unknown,"development, system, code, application, deployment, develop"
153,1,"application development, unit test, full, computer, backend, application, frontend, code, coding, data, sql, documentation","analytical, work, documentation, communication",unknown,bachelor,unknown,"development, code, application, test, develop, framework, refactoring"
154,1,"c, design, html, build, application, web, visual, javascript, data, command, documentation, programming","analytical thinking, work, documentation, analytical, communication",unknown,unknown,unknown,"develop, web, application"
156,1,"design, oop, redis, design patterns, security, performance, java, software engineer, system, computer, software, backend, aws, programming, code, cloud, software architecture, data, scalability","attention to detail, stakeholder, time",unknown,unknown,unknown,"system, code, development"
169,1,"shell, full, security, application, aws, test, performance, data, azure","time, teamwork, learning, attention to detail, work",unknown,unknown,unknown,"test, development, application"
