id,category_id,technical_requirements,soft_skills,domain_knowledge,education_requirement,experience_level,project_experience
3366,4,"six sigma, daily, compliance, quality control, business, performance, quality, team, capacity, lean, production, microsoft","collaboration, feedback, organizational skills, customer, team, analytical",lean,unknown,unknown,"system, control"
3367,4,"change management, strategic, operations, daily, oracle, operational, performance, erp, team, data, communication, efficiency","analytical thinking, planning, team management, strategic thinking, team, communication",unknown,bachelor,unknown,"system, control, efficiency"
3370,4,"communication skills, business, team, reporting","communication skills, team",unknown,unknown,unknown,unknown
3372,4,"communication skills, process, compliance, demand, business, performance, budget, quality, team, power","communication skills, planning, team, process, analytical",unknown,unknown,unknown,"track, system, tracking"
3374,4,"sap, team, time","team, time",unknown,unknown,unknown,unknown
3375,4,"performance, team, data, production, communication","attention, feedback, team, analytical, communication",unknown,unknown,unknown,optimization
3377,4,"communication skills, project, operations, business, problem solving, performance, team, data, communication","communication skills, analytical thinking, planning, leadership, goal, problem solving, responsibility, customer, team, multitasking, communication",unknown,unknown,unknown,unknown
3378,4,"communication skills, data analysis, operations, daily, business, team, data, communication","communication skills, planning, feedback, goal, team, communication",unknown,unknown,unknown,unknown
3379,4,"change management, operations, reporting, operational excellence, logistics, continuous improvement, inventory, standard, procurement, budget, team, process, data, project management, production, microsoft","customer, task, continuous, team, process, analytical",unknown,unknown,unknown,"logistics, system, inventory"
3382,4,"communication skills, operations, daily, continuous improvement, compliance, business, standard, performance, budget, team, data","communication skills, collaboration, responsibility, continuous, attention to detail, team",unknown,unknown,unknown,track
3383,4,"communication skills, kpi, time, daily, logistics, reporting, sap, inventory, business, performance, team, process, report, warehouse, communication","communication skills, resilience, time, customer, responsibility, team, process, communication",unknown,unknown,mid-level,"kpi, logistics, track, inventory, tracking, control"
3384,4,"daily, project, team","organizational, team",unknown,unknown,junior,"system, optimization"
3386,4,"business, operational",leadership,unknown,bachelor,unknown,unknown
3388,4,"strategic, supply, operations, project, logistics, cost, business, operational, standard, quality, team, process, project management, communication","strategic, critical thinking, leadership, customer, team management, team, process, communication",unknown,unknown,junior,"cost, logistics, system, tracking"
3389,4,"microsoft, operations, time, reporting, business, operational, problem solving, quality, team, data, decision, communication","collaboration, time, planning, customer, problem solving, attention to detail, team, decision, communication",unknown,unknown,unknown,"system, control, tracking"
3392,4,"supply, daily, logistics, sap, business, warehouse, production, communication","responsibility, planning, analytical, communication",unknown,unknown,unknown,"logistics, system, control"
3393,4,"project, operations, reporting, business, performance, time management, team, data, project management, communication","goal, responsibility, time management, team, communication",unknown,unknown,unknown,optimization
3394,4,"communication skills, business, team","communication skills, analytical thinking, planning, organizational, team",unknown,unknown,unknown,unknown
3395,4,"communication skills, strategic, project, reporting, microsoft, business, quality, team, data, communication","accountability, communication skills, strategic, collaboration, initiative, attention to detail, team, analytical, communication",unknown,unknown,unknown,initiative
3396,4,"data analysis, strategic, operations, business, operational, quality, team, project management, efficiency","strategic, collaboration, multitask, feedback, planning, goal, organizational, team",unknown,unknown,unknown,efficiency
3398,4,"logistics, warehouse, warehouse operations",unknown,unknown,unknown,unknown,logistics
3400,4,"process, operations, supply, logistics, compliance, cost, sap, performance, budget, quality, team, power, microsoft","responsibility, team, process",unknown,unknown,unknown,"logistics, cost, control"
3401,4,"data analysis, operations, reporting, quality control, compliance, business, quality, team, process, report, production","feedback, planning, leadership, customer, team, process",unknown,unknown,unknown,"system, control"
3402,4,"communication skills, operations, reporting, daily, change, supply, business, operational, performance, inventory, budget, quality, team, daily operations, project management, communication","communication skills, stakeholder, team, communication",unknown,bachelor,mid-level,"track, inventory"
3403,4,"process mapping, cost, continuous improvement, business, quality, team, process","organizational, continuous, team, process, analytical",unknown,unknown,unknown,"cost, system"
3404,4,"process, team, time","responsibility, process, team, time",unknown,unknown,unknown,unknown
3405,4,"communication skills, problem, project, operational, performance, data","communication skills, problem, customer",unknown,bachelor,junior,"system, control, tracking"
3406,4,"logistics, resource, operational, efficiency, inventory control, process, warehouse, production, microsoft","accountability, attention to detail, process",unknown,unknown,unknown,"logistics, inventory, resource, control, efficiency"
3416,4,"communication skills, team","adaptability, communication skills, professionalism, team",unknown,unknown,unknown,unknown
3419,4,"daily, production, team",team,unknown,unknown,mid-level,unknown
3425,4,"communication skills, operations, supply, reporting, business, operational, performance, quality, team, performance monitoring, communication","communication skills, collaboration, adaptability, organizational skills, goal, attention to detail, team, analytical, communication",unknown,unknown,unknown,unknown
3426,4,"supply, daily, inventory, problem solving, procurement, team, workflow, communication skills, operations, root, operational, project management, communication, data analysis, logistics, quality control, business, process, data, efficiency","communication skills, collaboration, problem solving, workflow optimization, customer, team, process, communication",unknown,unknown,unknown,"optimization, logistics, system, inventory, workflow, control, efficiency"
3427,4,"communication skills, operational performance, operations, supply, daily, logistics, time, business, operational, problem solving, team, process, data, communication, microsoft","communication skills, time, customer focus, planning, critical, initiative, problem solving, customer, team, process, analytical, communication",unknown,unknown,junior,"logistics, initiative, planner"
3428,4,"communication skills, data analysis, problem, operations, reporting, change, time, compliance, cost, operational, performance, time management, continuous, team, communication","communication skills, problem, time, leadership, planning, feedback, responsibility, time management, continuous, team, communication",unknown,unknown,unknown,"cost, optimization, tracking"
3429,4,"strategic, operations, time, business, team, data, decision, report, communication","strategic, time, feedback, team, negotiation, decision, communication",unknown,unknown,unknown,unknown
3431,4,"communication skills, time, performance, quality, team, communication","communication skills, time, feedback, attention to detail, team, communication",unknown,unknown,unknown,unknown
3432,4,"data analysis, reporting, daily, time management, data, communication","analytical thinking, planning, responsibility, time management, planning skills, communication",unknown,bachelor,junior,"system, tracking"
3433,4,"risk, operations, operational, performance, team, process, data, daily operations, report","responsibility, team, process",unknown,unknown,unknown,control
3434,4,"communication skills, strategic, daily, business, performance, team, report, communication","communication skills, strategic, leadership, customer, responsibility, team, communication",unknown,unknown,mid-level,system
3436,4,"communication skills, business, team, process, data","communication skills, multitask, attention, organizational, customer, team, process",unknown,bachelor,junior,unknown
3437,4,"process, operations, supply, reporting, demand, operational, team, power, data, communication, efficiency","attention, planning, leadership, customer, team, process, analytical, communication",unknown,unknown,unknown,efficiency
3438,4,"strategic, supply, operations, time, logistics, compliance, continuous improvement, business, quality, team, process, project management, communication","strategic, time, critical thinking, leadership, team management, continuous, team, process, communication",unknown,unknown,junior,logistics
3440,4,"erp systems, reporting, efficiency, team, data, microsoft","analytical, team",unknown,bachelor,unknown,"system, efficiency"
3443,4,"communication skills, risk, operations, reporting, compliance, quality, team, report","communication skills, analytical, team",unknown,unknown,unknown,system
3444,4,"data, problem, communication","problem, communication",unknown,unknown,unknown,unknown
3445,4,"communication skills, process, operations, performance, efficiency, team, power, project management, communication","communication skills, feedback, responsibility, team, process, analytical, communication",unknown,master,unknown,"track, efficiency"
3447,4,"communication skills, strategic, project, business, quality, team, process, report, microsoft","communication skills, strategic, feedback, organizational, customer, team, process",unknown,bachelor,unknown,unknown
3448,4,"communication skills, reporting, time, business, team, communication","communication skills, time, planning, initiative, responsibility, team, negotiation, communication",unknown,unknown,unknown,initiative
3449,4,"six sigma, supply, cost, performance, team, operations management, warehouse, power bi, production, communication skills, project, operations, capacity, microsoft, kaizen, lean, data analysis, logistics, business, process, data","communication skills, collaboration, analytical thinking, leadership, critical, customer, stakeholder, team, process, analytical",lean,unknown,unknown,"optimization, logistics, cost, study, control"
3450,4,"communication skills, operations, cost, operational, communication","communication skills, planning, organizational skills, task, communication",unknown,unknown,mid-level,"cost, system, control, tracking"
3451,4,"communication skills, data analysis, operations, capacity, team","communication skills, goal, team",unknown,unknown,unknown,unknown
3452,4,"communication skills, business, performance, problem solving, team, performance monitoring","communication skills, collaboration, problem solving, customer, team",unknown,unknown,unknown,track
3453,4,"logistics, warehouse, warehouse operations",unknown,unknown,unknown,unknown,logistics
3458,4,"problem, communication skills, reporting, daily, compliance, business, quality, team, process, root, communication","problem, communication skills, analytical thinking, leadership, customer, task, team, process, analytical, communication",unknown,unknown,unknown,unknown
3459,4,"budget, standard, process","attention, process",unknown,unknown,unknown,unknown
3461,4,"strategic, operations, time, daily, logistics, compliance, business, operational, performance, efficiency, quality, team, process, data, communication","accountability, strategic, collaboration, time, customer, attention to detail, team, process, analytical, communication",unknown,unknown,unknown,"logistics, track, system, control, efficiency"
3462,4,"strategic, risk, cost, business, budget, team, power, report, communication, efficiency","accountability, strategic, customer, responsibility, stakeholder, team, strategic thinking, communication",unknown,unknown,unknown,"track, cost, system, efficiency"
3463,4,"risk, operations, time, daily, root cause analysis, operational, continuous, quality, team, process, data, production, microsoft","continuous, time, team, process",unknown,bachelor,unknown,unknown
3464,4,"communication skills, process, risk, operations, strategic, daily, reporting, compliance, operational, strategic planning, communication, efficiency","communication skills, strategic, planning, initiative, process, communication",unknown,unknown,unknown,"system, initiative, efficiency"
3465,4,"vendor, operations, logistics, compliance, communication","negotiation, communication",unknown,unknown,unknown,logistics
3466,4,"communication skills, process, operations, time, business, efficiency, team, power, capacity, production, communication","communication skills, time, organizational, customer, team, process, communication",unknown,unknown,unknown,efficiency
3467,4,"data analysis, strategic, operations, reporting, kpi, business, performance, problem solving, team, process, data, production, efficiency","strategic, leadership, problem solving, team, process",unknown,unknown,mid-level,"kpi, optimization, control, efficiency"
3468,4,"supply, time, business, process, warehouse","time, process",unknown,unknown,unknown,unknown
3471,4,"communication skills, risk, operations, change, project, strategic, daily, business, operational, procurement, team, process, data, decision, capacity, operations management, microsoft","communication skills, strategic, resilience, adaptability, attention, planning, leadership, feedback, customer, responsibility, team, process, decision, analytical",unknown,master,junior,"system, reduction"
3472,4,"change, business, quality, team, production","attention, team, customer",unknown,unknown,unknown,system
3474,4,"communication skills, risk, operations, change, project, strategic, daily, business, operational, procurement, team, process, data, decision, capacity, operations management, microsoft","communication skills, strategic, resilience, adaptability, attention, planning, leadership, feedback, customer, responsibility, team, process, decision, analytical",unknown,master,junior,"system, reduction"
3475,4,"vendor, communication skills, business operations, daily, continuous improvement, compliance, business, operational, time management, erp, quality, team, process, data, project management, efficiency","communication skills, collaboration, initiative, organizational, customer, time management, continuous, attention to detail, team, process, analytical",unknown,unknown,unknown,"initiative, study, efficiency"
3478,4,"compliance, quality control, performance, quality, team, production, efficiency","team management, leadership, team, analytical thinking",unknown,unknown,unknown,"control, efficiency"
3479,4,"data analysis, kaizen, operations, daily, demand, business, operational, performance, inventory, lean, team, process, data, warehouse, production, efficiency","planning, leadership, customer, team management, team, process",lean,unknown,unknown,"track, inventory, efficiency"
3481,4,"project, business, operational, capacity, team, data, project management, production, microsoft","task, leadership, team, customer",unknown,unknown,unknown,unknown
3482,4,"process, risk, operations, root cause analysis, compliance, business, operational, performance, quality, team, power, data","team, process",unknown,unknown,unknown,"reduction, control"
3483,4,"communication skills, microsoft, operations, logistics, continuous improvement, compliance, operational, performance, resource, efficiency, continuous, team, data, team leadership, production, communication","communication skills, leadership, planning, team management, continuous, team, communication",unknown,unknown,unknown,"logistics, system, resource, efficiency"
3486,4,"communication skills, strategic, operations, business, performance, team, strategic planning, data, report, communication","communication skills, strategic, analytical thinking, adaptability, planning, leadership, organizational skills, responsibility, team, analytical, communication",unknown,bachelor,unknown,control
3487,4,"business, production, strategic, operational","strategic, customer",unknown,bachelor,unknown,unknown
3488,4,"process, strategic, time, compliance, performance, team, capacity, power, communication","accountability, process, strategic, resilience, time, leadership, team, negotiation, communication",unknown,unknown,unknown,system
3489,4,"logistics, warehouse, warehouse operations",unknown,unknown,unknown,unknown,logistics
3490,19,"seo, content, google, client, performance, team, performance metrics","analytical, team, time",unknown,unknown,unknown,unknown
3493,19,"press releases, digital, marketing, social, media, crm, brand, communication","creative, strategic, marketing, brand, communication",unknown,unknown,unknown,"digital, marketing, brand"
3495,19,"communication skills, market research, market, marketing, competitive, performance, customer, product, team, sales","communication skills, strategic, analytical thinking, feedback, leadership, marketing, customer, team, sales",unknown,bachelor,unknown,"market, marketing, sales, customer"
3497,19,"communication skills, market, marketing, brand management, brand positioning, performance, product, brand, team, negotiation, sales, communication","analytical, communication skills, time, marketing, flexibility, brand, team, negotiation, sales, communication",unknown,unknown,unknown,"market, marketing, brand, sales, strategy"
3499,19,"revenue growth, advertising, conversion, lead, facebook, google ads, marketing, campaign management, competitive, performance, revenue, media, team, campaign","strategic, creative, leadership, marketing, team",roi,unknown,unknown,"campaign, marketing"
3500,19,"powerpoint, market, excel, digital, marketing, performance, customer, product, team, value proposition, content, revenue growth, social, crm, brand, sales, trade, media, communication, collaboration","storytelling, creative, collaboration, initiative, marketing, customer, team, brand, sales, communication",unknown,bachelor,unknown,"market, digital, marketing, customer, brand, sales, strategy"
3501,19,"market, collaboration, email, performance, client, customer, crm, product, team, brand, communication","collaboration, time, feedback, relationship, customer, team, brand, analytical, communication",unknown,unknown,unknown,"market, brand, customer"
3503,19,"content, communication skills, target audience, marketing, social, media, product, brand, team, negotiation, sales, communication","communication skills, creative, time, initiative, marketing, relationship, responsibility, flexibility, team, brand, negotiation, sales, communication",unknown,unknown,unknown,"marketing, sales, brand, awareness"
3504,19,"communication skills, market, trade, marketing, competitive, presentation, brand management, performance, team, brand, product, sales","communication skills, creative, analytical thinking, leadership, marketing, presentation, problem solving, responsibility, active, brand, team, sales",unknown,unknown,junior,"market, marketing, awareness, brand, sales, strategy"
3507,19,"content, data analysis, advertising, marketing, brand, team, market trends, campaign, sales, communication","sales, marketing, brand, team, analytical, communication",unknown,unknown,unknown,"market, marketing, brand, campaign, sales"
3509,19,"press, marketing, brand management, customer, target, media, brand, product, sales, communication","creative, analytical thinking, marketing, customer, brand, sales, communication",unknown,bachelor,unknown,"customer, marketing, brand, sales"
3511,19,"content, market, advertising, email, digital, marketing, competitive, social, media, revenue, public relations, brand, team, data, product, value, paid, sales","strategic, marketing, team, brand, sales, public",unknown,unknown,unknown,"market, digital, marketing, awareness, brand, sales, strategy"
3512,19,"marketing strategy, market, data, lead, presentation skills, digital, marketing, email, customer, crm, team, product, product launches, value, sales, communication","presentation skills, marketing, customer, team, sales, communication",pricing,bachelor,unknown,"market, digital, marketing, customer, sales, strategy"
3513,19,"market, conversion, marketing, brand management, performance, customer, brand positioning, product, team, product launches, content, communication skills, brand, paid, sales, advertising, lead, value, performance metrics, data","communication skills, sales, strategic, time, leadership, critical, marketing, feedback, customer, brand, team, analytical",unknown,unknown,junior,"market, marketing, customer, brand, sales, strategy"
3514,19,"communication skills, market, digital, marketing, brand management, performance, digital marketing, media, product, brand, data, team, sales, communication","analytical, communication skills, creative thinking, marketing, responsibility, brand, team, sales, communication","pricing, digital marketing trends",unknown,unknown,"market, digital, marketing, awareness, brand, sales, strategy"
3516,19,"trade shows, lead, presentation skills, competitive, performance, revenue, crm, pipeline, event, negotiation, salesforce, team, hubspot, sales","presentation skills, flexibility, team, negotiation, sales",unknown,unknown,unknown,sales
3518,19,"lead, digital, marketing, competitive, performance, market trends, revenue, crm, brand, team, data, campaign, communication","strategic, time, leadership, marketing, brand, team, analytical, communication",roi,unknown,unknown,"market, digital, marketing, brand, campaign"
3519,19,"digital, marketing, brand management, customer, product, team, product launches, market research, content marketing, social, brand, sales, negotiation skills, advertising, trade, branding, communication, collaboration, pipeline, data, social media marketing","creative, collaboration, marketing, customer, responsibility, time management, brand, team, negotiation skills, sales, communication",pricing,unknown,unknown,"market, digital, marketing, customer, brand, sales"
3520,19,"content, communication skills, target audience, marketing, social, media, product, brand, team, negotiation, sales, communication","communication skills, creative, time, initiative, marketing, relationship, responsibility, flexibility, team, brand, negotiation, sales, communication",unknown,unknown,unknown,"marketing, sales, brand, awareness"
3521,19,"communication skills, market, data, collaboration, lead, digital, marketing, media, target, brand, team, product launches, branding, sales, negotiation skills","communication skills, collaboration, marketing, team, brand, sales, negotiation skills",unknown,unknown,unknown,"market, digital, marketing, brand, sales, strategy"
3523,19,"seo, content, market, google analytics, digital, google, performance, content marketing","marketing, time",unknown,unknown,unknown,"market, digital, marketing"
3524,19,"market, digital, marketing, customer, product, team, content, sales enablement, marketing campaigns, sales, data, lead, upsell, competitive analysis, communication, competitive, revenue, pipeline, market trends","marketing, customer, team, sales, communication",unknown,unknown,unknown,"market, automation, digital, marketing, awareness, customer, sales, strategy"
3525,19,unknown,"leadership, goal",unknown,unknown,junior,unknown
3526,19,"trade, marketing, brand management, social, brand, product, sales, negotiation skills","sales, marketing, active, brand, analytical, negotiation skills",unknown,master,unknown,"marketing, brand, sales"
3528,19,"marketing strategy, market, sales, b2c, collaboration, data analysis, trade, marketing, b2b, performance, media, brand, team, product launches, value, value proposition","strategic, collaboration, feedback, marketing, responsibility, brand, team, sales",pricing,unknown,unknown,"market, marketing, brand, sales, strategy"
3529,19,"marketing strategy, market, trade shows, marketing, customer, marketing management, team, market research, lead generation, social, marketing campaigns, event, brand, sales, value, communication, collaboration, competitive, b2b, data, campaign","strategic, collaboration, marketing, customer, brand, team, sales, communication",unknown,bachelor,unknown,"market, marketing, customer, brand, campaign, sales, strategy"
3530,19,"content, market, sales, marketing strategy, collaboration, communication skills, trade, digital, marketing, performance, social, media, marketing campaigns, brand, team, product, competitive analysis","analytical, communication skills, collaboration, marketing, brand, team, sales",unknown,unknown,unknown,"market, digital, marketing, brand, sales, strategy"
3531,19,"market, conversion, digital, marketing, performance, customer, team, content, social, content marketing, crm, brand, trade, digital marketing, media, customer acquisition, email marketing, client, data","marketing, goal, customer, brand, team, analytical",roi,unknown,unknown,"market, digital, marketing, customer, marketing automation, brand, strategy"
