id,category_id,technical_requirements,soft_skills,domain_knowledge,education_requirement,experience_level,project_experience
2629,5,"strategic, product vision, stakeholder management, problem solving, customer, product, team, product roadmap, user, impact, value, product backlog, growth, leadership, business, stakeholder, agile, roadmap, data","strategic, conflict, leadership, stakeholder management, problem solving, responsibility, flexibility, customer, learning, stakeholder, conflict resolution, product, roadmap, vision, analytical",unknown,unknown,unknown,"user, product, roadmap, analysis, strategy"
2630,5,"communication skills, market, market research, strategic, business, customer, product management, team, product, minimum, value, communication","customer communication, communication skills, strategic, alignment, analytical thinking, customer, product, communication",unknown,unknown,unknown,"analysis, product"
2631,5,"market, product vision, customer, problem solving, team, product, user experience, market research, project, product strategy, user, product management, strategic thinking, product lifecycle, usability testing, impact, communication, customer feedback, leadership, business, competitive, roadmap, data","project, collaboration, time, alignment, leadership, feedback, customer, problem solving, learning, product, roadmap, strategic thinking, vision, curiosity, communication",feedback,unknown,unknown,"user, competitive, roadmap, product, strategy"
2632,5,"communication skills, product vision, growth, business, backlog, impact, product management, product, roadmap, data, user experience, team, product marketing","communication skills, feedback, critical, product, roadmap, vision, analytical",feedback,unknown,unknown,"user, product, roadmap"
2633,5,"customer, product, team, sql, communication skills, project, product strategy, user stories, user, launch, impact, product backlog, value, communication, requirement, growth, business, agile, data","communication skills, project, feedback, customer, flexibility, learning, product, analytical, communication",feedback,unknown,unknown,"user, definition, product, strategy"
2635,5,"usability, product strategy, leadership, growth, user, customer, impact, figma, agile, product, team, moscow, user experience, value, scrum, ui","collaboration, time, alignment, organization, leadership, customer, empathy, flexibility, product",unknown,unknown,unknown,"user, product, strategy"
2637,5,"communication skills, market research, market, competitive, customer, team, product, minimum","analytical, communication skills, product, customer",unknown,bachelor,unknown,"competitive, product, strategy"
2638,5,"requirement, market, product strategy, launch planning, business, competitive, customer, pricing, revenue, launch, product, data, communication","planning, initiative, customer, product, vision, communication",unknown,master,mid-level,"automation, planning, competitive, product, analysis, strategy"
2639,5,"usability, market, customer, product, team, sql, communication skills, market research, product roadmap, user, pricing, launch, product management, product lifecycle, value, communication, competitive, business, release, agile, roadmap, data, scrum","communication skills, organization, planning, feedback, customer, roadmap, product, communication",feedback,master,unknown,"planning, user, competitive, release, product, roadmap"
2640,5,"market research, market, data analysis, project, business, competitive, product, team, user experience, minimum, value, feature","vision, project, product",unknown,unknown,unknown,"competitive, user, analysis, product"
2642,5,"communication skills, market, google, competitive, product management, product, team, prototypes, communication","communication skills, feedback, product, analytical, communication",feedback,unknown,unknown,"competitive, product"
2643,5,"communication skills, market, growth, pricing strategy, business, problem solving, product, data, communication","communication skills, initiative, problem solving, responsibility, product, negotiation skills, analytical, communication",unknown,bachelor,unknown,"product, strategy"
2645,5,"ux, growth, user, impact, strategic thinking, product, team","time, planning, learning, strategic thinking, product",unknown,unknown,unknown,"planning, user, product"
2646,5,"market, product vision, customer, product, team, communication skills, product strategy, user stories, user, launch, ux, wireframes, mockups, value, communication, competitive, prioritization, roadmap, data","communication skills, alignment, collaboration, customer, learning, roadmap, product, prioritization, vision, curiosity, communication",unknown,unknown,unknown,"user, competitive, definition, roadmap, product, analysis, strategy"
2647,5,"communication skills, market, strategic, growth, leadership, business, customer, pricing, launch, revenue, product management, stakeholder, agile, product, team, strategic thinking","communication skills, strategic, alignment, collaboration, leadership, feedback, customer, stakeholder, product, strategic thinking",feedback,unknown,unknown,"product, strategy"
2648,5,"market, market research, pricing, launch, product management, product, team, data, product marketing, product market, communication","presentation skills, time, product, communication",unknown,unknown,unknown,product
2651,5,"strategic, stakeholder management, backlog, customer, product, team, sql, product roadmap, user, impact, value, product backlog, growth, leadership, business, stakeholder, agile, roadmap, data","strategic, leadership, stakeholder management, customer, responsibility, flexibility, learning, stakeholder, conflict resolution, product, roadmap, vision",unknown,unknown,unknown,"user, product, roadmap, analysis, strategy"
2655,5,"usability, market, communication skills, project, user, business, customer, product management, stakeholder, product, team, data, strategic thinking","accountability, communication skills, project, collaboration, feedback, customer, responsibility, empathy, learning, stakeholder, product, strategic thinking, product intuition, analytical",feedback,unknown,unknown,"user, product"
2656,5,"market, market research, pricing, launch, product management, product, team, data, product marketing, product market, communication","presentation skills, time, product, communication",unknown,unknown,unknown,product
2657,5,"requirement, ux, communication skills, project, user, business, wireframes, mockups, jira, confluence, agile, product, team, product backlog","communication skills, project, collaboration, time, feedback, critical, planning, learning, product, analytical",feedback,unknown,unknown,"planning, user, product"
2659,5,"ux, metrics, product strategy, retention, leadership, growth, user, competitive, product lifecycle, impact, prd, launch, product management, agile, product, team, user experience","collaboration, time, alignment, feedback, leadership, presentation, flexibility, learning, product, vision",feedback,unknown,mid-level,"user, competitive, product, strategy"
2660,5,"communication skills, market, growth, leadership, impact, business, customer, pricing, launch, revenue, product management, stakeholder, agile, product, team, strategic thinking","communication skills, alignment, collaboration, leadership, feedback, customer, stakeholder, product, strategic thinking",feedback,unknown,unknown,"strategy, product, automation"
2662,5,"ux, communication skills, data, product roadmap, conversion, value, user, business, stakeholder, agile, product, roadmap, team, product backlog","communication skills, stakeholder, product, roadmap",unknown,unknown,unknown,"user, story, product, roadmap"
2664,5,"communication skills, product strategy, product analytics, growth, user, product management, roadmap, product, team, user experience, minimum","communication skills, teamwork, analytical thinking, time, learning, product, roadmap",unknown,unknown,unknown,"roadmap, user, product, strategy"
2665,5,"market, strategic, project, growth, user, competitive, revenue, launch, strategic thinking, product, data, team","accountability, strategic, collaboration, project, teamwork, feedback, learning, strategic thinking, product, vision, analytical",feedback,unknown,unknown,"user, competitive, product"
2666,5,"market, customer, team, product, churn, conversion rate, user stories, user, product management, growth strategy, product backlog, value, communication, google analytics, metrics, retention, lifetime value, growth, competitive, business, prioritization","customer, responsibility, learning, product, prioritization, curiosity, communication",unknown,unknown,mid-level,"user, competitive, product, strategy"
2667,5,"communication skills, problem, team alignment, leadership, business, impact, launch, product management, product, team, data, sql, moscow, feature","communication skills, problem, collaboration, alignment, organization, leadership, critical, presentation skills, empathy, product, analytical",unknown,unknown,unknown,"analysis, product"
2672,5,"market, data, project, strategic, data analysis, leadership, business, competitive, problem solving, stakeholder, team, product, prioritization, decision, sql, communication","accountability, strategic, problem solving, flexibility, learning, product, project, alignment, initiative, decision, communication, collaboration, time, organization, leadership, presentation skills, empathy, stakeholder, prioritization",unknown,unknown,unknown,"competitive, story, product, report, analysis"
2673,5,"communication skills, market, strategic, growth, decision making, stakeholder management, business, competitive, impact, customer, revenue, pricing, leadership, product, team, data, communication","communication skills, strategic, alignment, analytical thinking, planning, feedback, decision making, presentation skills, stakeholder management, customer, leadership, product, communication",feedback,unknown,unknown,"planning, competitive, product, analysis, strategy"
2674,5,"market research, customer feedback, market, product lifecycle, customer, product, team, communication","planning, feedback, customer, product, communication",feedback,unknown,unknown,"planning, report, product"
2675,5,"market, product vision, customer, problem solving, team, product, user experience, communication skills, market research, project, product strategy, user, product management, strategic thinking, product lifecycle, usability testing, impact, communication, customer feedback, leadership, business, competitive, roadmap, data","communication skills, project, collaboration, time, alignment, leadership, feedback, customer, problem solving, learning, product, roadmap, strategic thinking, vision, curiosity, communication",feedback,unknown,unknown,"user, competitive, roadmap, product, strategy"
2676,5,"communication skills, data, strategic, growth, leadership, user, business, backlog, impact, stakeholder management, agile, team, product, prioritization, communication","communication skills, strategic, alignment, collaboration, conflict, leadership, stakeholder management, flexibility, learning, conflict resolution, product, prioritization, communication",unknown,unknown,unknown,"user, analysis, product"
2678,5,"ux, communication skills, data, product roadmap, conversion, value, user, business, stakeholder, agile, product, roadmap, team, product backlog","communication skills, stakeholder, product, roadmap",unknown,unknown,unknown,"user, story, product, roadmap"
2679,5,"market research, market, product, team, communication","presentation skills, responsibility, product, analytical, communication",unknown,unknown,mid-level,"product, strategy"
2680,5,"customer, team, product, problem, sprint planning, product roadmap, user stories, user, product management, ux, mockups, product backlog, communication, google analytics, metrics, okrs, business, agile, roadmap, prioritization","problem, time, planning, customer, learning, product, roadmap, prioritization, curiosity, communication",unknown,unknown,mid-level,"planning, user, story, product, roadmap, strategy"
2684,5,"mvp, project, leadership, decision making, competitive, business, customer, problem solving, agile, product, team, data, minimum, value, scrum, communication","project, time, analytical thinking, organization, leadership, decision making, presentation, customer, problem solving, product, communication",unknown,bachelor,unknown,"mvp, competitive, product, analysis, strategy"
2685,5,"problem, communication skills, data, metrics, amplitude, product vision, mixpanel, user, competitive, customer, problem solving, product management, agile, team, product, roadmap","problem, communication skills, feedback, customer, problem solving, roadmap, product, vision",feedback,unknown,unknown,"user, competitive, product, roadmap"
2688,5,"market, strategic, project, product strategy, leadership, business, impact, customer, agile, product, team, data, strategic thinking, value, communication","project, strategic, organization, leadership, customer, product, strategic thinking, vision, communication",unknown,unknown,unknown,"strategy, product, automation"
2690,5,"ux, communication skills, market, metrics, project, growth, user, competitive, product management, agile, product, team, feature","communication skills, project, time, feedback, product",feedback,unknown,unknown,"report, user, competitive, product"
2692,5,"market research, google analytics, project, product roadmap, leadership, user, business, customer, agile, product, data, scrum, communication","project, teamwork, organization, leadership, feedback, customer, product, roadmap, vision, communication",feedback,unknown,mid-level,"user, product, roadmap"
2693,5,"data, strategic, conversion, growth, business, backlog, agile, product, minimum, team, product marketing","strategic, product",unknown,unknown,unknown,"analysis, product, automation"
2696,5,"metrics, product vision, leadership, growth, user, product, user experience","leadership, learning, vision, product",unknown,unknown,unknown,"user, product"
2698,5,"ux, communication skills, market, metrics, project, growth, user, competitive, product management, agile, product, team, feature","communication skills, project, time, feedback, product",feedback,unknown,unknown,"report, user, competitive, product"
2699,5,"market, strategic, product vision, customer, confluence, product, user experience, market research, project, product strategy, jira, launch, product management, product lifecycle, product backlog, competitive analysis, communication, leadership, growth, business, competitive, agile, roadmap, data, scrum","project, collaboration, alignment, strategic, organization, leadership, customer, empathy, learning, product, roadmap, vision, analytical, communication",unknown,unknown,unknown,"automation, user, competitive, roadmap, product, analysis, strategy"
2700,5,"market, product vision, customer, problem solving, team, product, user experience, market research, project, product strategy, user, product management, strategic thinking, product lifecycle, usability testing, impact, communication, customer feedback, leadership, business, competitive, roadmap, data","project, collaboration, time, alignment, leadership, feedback, customer, problem solving, learning, product, roadmap, strategic thinking, vision, curiosity, communication",feedback,unknown,unknown,"user, competitive, roadmap, product, strategy"
2707,5,"problem, market, market research, customer feedback, project, product strategy, leadership, business, impact, customer, product management, visionary, team, product, data, communication","problem, project, collaboration, time, alignment, leadership, feedback, customer, responsibility, learning, product, vision, curiosity, communication",feedback,unknown,unknown,"product, strategy"
2711,5,"problem, market, market research, customer feedback, project, product strategy, leadership, business, impact, customer, product management, visionary, team, product, data, communication","problem, project, collaboration, time, alignment, leadership, feedback, customer, responsibility, learning, product, vision, curiosity, communication",feedback,unknown,unknown,"product, strategy"
2713,5,"market, product vision, customer, product, team, user experience, communication skills, market research, problem, project, product strategy, user, pricing, product management, strategic thinking, product lifecycle, data, communication, customer feedback, leadership, business, usability testing","communication skills, problem, project, collaboration, alignment, organization, leadership, feedback, presentation skills, customer, responsibility, learning, product, strategic thinking, vision, curiosity, communication",feedback,unknown,unknown,"automation, user, product, strategy"
2720,5,"market, data, project, strategic, data analysis, leadership, competitive, problem solving, stakeholder, team, product, prioritization, decision, sql, communication","accountability, strategic, problem solving, flexibility, learning, product, project, alignment, initiative, decision, communication, collaboration, time, organization, leadership, feedback, presentation skills, empathy, stakeholder, prioritization",feedback,unknown,unknown,"competitive, story, product, report, analysis"
2721,5,"mvp, decision making, customer, problem solving, product, team, project, impact, minimum, value, communication, leadership, business, competitive, agile, prioritization, roadmap, data, scrum","project, collaboration, analytical thinking, time, organization, leadership, planning, decision making, presentation, customer, problem solving, product, roadmap, prioritization, communication",unknown,bachelor,unknown,"mvp, planning, competitive, product, roadmap, analysis, strategy"
2722,5,"market, data, project, strategic, data analysis, leadership, competitive, problem solving, stakeholder, team, product, prioritization, decision, sql, communication","accountability, strategic, problem solving, flexibility, learning, product, project, alignment, initiative, decision, communication, collaboration, time, organization, leadership, feedback, presentation skills, empathy, stakeholder, prioritization",feedback,unknown,unknown,"competitive, story, product, report, analysis"
2724,5,"project, data modeling, change, requirements, business, problem solving, agile, functional, process, sql","technical, business, documentation, problem solving",unknown,unknown,mid-level,"requirements, documentation, analysis, process"
2727,5,"document, functional requirements, problem solving, confluence, workflow, sql, project, user, jira, microsoft, change, functional, communication, bpmn, process modeling, business, uml, agile, process, data, scrum","teamwork, organization, planning, business, problem solving, responsibility, active, workflow, documentation, analytical, communication",business process modeling,unknown,mid-level,"requirements, process, workflow, documentation, analysis"
2728,5,"problem, data modeling, uml, business, requirements, user, agile, functional, business analysis, process, data, sql, scrum","problem, business, technical, responsibility, learning, documentation, analytical",value,unknown,mid-level,"scenario, requirements, process, documentation, analysis"
2729,5,"business requirements, project, requirements, business, problem solving, business analysis, communication","analytical thinking, teamwork, business, problem solving, documentation, communication",unknown,unknown,mid-level,"requirements, documentation, analysis"
2732,5,"project, requirements, business, user, business analysis, functional, sql, communication","business, communication, teamwork",unknown,unknown,unknown,"requirements, analysis"
2735,5,"change management, project, kpis, risk, requirements, business, business analysis, process, data, microsoft","decision, planning, business, customer",unknown,master,unknown,"build, requirements, analysis, process"
2737,5,"market, root, business, jira, erp, agile, power, sql, scrum, communication","planning, initiative, business, responsibility, analytical, communication",unknown,bachelor,mid-level,"scenario, analysis"
2739,5,"business requirements, use, communication skills, kpis, user, business, uml, problem solving, jira, confluence, agile, functional, process, data, scrum","communication skills, analytical thinking, decision making, business, problem solving, technical, planning skills, documentation",value,unknown,unknown,"use, requirements, process, documentation, analysis"
2740,5,"powerpoint, use, market, kpis, microsoft, change, presentation skills, critical, user, business, business analysis, word, process, data, workflow, power bi, communication","analytical thinking, time, attention, decision making, planning, critical, business, presentation skills, customer, technical, responsibility, organization, workflow, communication",unknown,bachelor,unknown,"use, workflow, analysis, process"
2741,5,"project, microsoft, risk, stakeholder management, business, problem solving, jira, stakeholder, communication","analytical thinking, time, teamwork, planning, business, stakeholder communication, problem solving, organization skills, time management, stakeholder, communication",value,unknown,mid-level,stakeholder
2743,5,"business requirements, communication skills, data analysis, business process improvement, document, project, risk, functional requirements, user stories, requirements, business, user, crm, agile, business analysis, process, business case, communication","communication skills, collaboration, feedback, planning, business, customer, technical, time management, negotiation, documentation, communication",unknown,unknown,unknown,"requirements, case, process, documentation, analysis"
2745,5,"use, project, requirements, business, backlog, impact, stakeholder, business analysis","business, technical, stakeholder, learning, documentation",unknown,unknown,unknown,"use, requirements, impact, stakeholder, documentation, analysis"
2748,5,"interviews, project, document, presentation skills, uml, business, user, power, process, data, sql, scrum, communication, microsoft","time, organization, presentation skills, business, customer, responsibility, technical, learning, analytical, communication",unknown,master,unknown,"analysis, process"
2752,5,"use, requirement, data analysis, project, microsoft, workflow diagrams, requirements, business, user, problem solving, presentation, jira, agile, business analysis, process, scrum, communication","requirement, analytical thinking, teamwork, planning, initiative, business, presentation, customer, problem solving, time management, learning, workflow, documentation, communication",unknown,master,mid-level,"use, requirements, model, process, workflow, documentation, analysis"
2753,5,"requirement, project, uml, document",requirement,unknown,unknown,unknown,analysis
2760,5,"interviews, project, document, presentation skills, uml, user, business, requirements, power, process, data, scrum, communication, microsoft","time, organization, presentation skills, planning, business, customer, responsibility, technical, learning, documentation, analytical, communication",unknown,master,unknown,"requirements, documentation, analysis, process"
2761,5,"use, problem, requirement, project, change, user, business, requirements, impact, business analysis, process, communication","problem, requirement, teamwork, time, planning, business, organization skills, documentation, communication",unknown,unknown,unknown,"use, requirements, impact, process, documentation, analysis"
2763,5,"business requirements, project, requirements, business, presentation, problem solving, functional, process, data, brd, communication, microsoft","teamwork, analytical thinking, business, presentation, problem solving, communication",unknown,unknown,unknown,"build, requirements, process"
2769,5,"user, requirements, business, problem solving, impact, jira, confluence, erp, functional, business analysis, data","analytical thinking, business, problem solving, technical, learning, documentation",unknown,unknown,unknown,"requirements, impact, building, documentation, analysis"
2770,5,"powerpoint, business, problem solving, business analysis, word, process, data, sql, communication","business, problem solving, documentation, analytical, communication",unknown,unknown,unknown,"documentation, analysis, process"
2771,5,"use, communication skills, project, tableau, requirements, business, process, data","active, communication skills, business, analytical",unknown,unknown,unknown,"use, build, requirements, process, analysis"
2773,5,"requirement, data analysis, change management, market, user, business, problem solving, functional, process, data, communication","requirement, teamwork, analytical thinking, organization, planning, decision making, business, customer, problem solving, time management, communication",value,unknown,unknown,"analysis, process"
2775,5,"market, project, requirements, business, problem solving, stakeholder, agile, process, scrum, communication","teamwork, business, problem solving, technical, customer, stakeholder, communication",unknown,unknown,unknown,"stakeholder, requirements, process"
2776,5,"communication skills, market, market research, project, metrics, business, impact, crm, data, sql, communication","communication skills, collaboration, organization, business, technical, analytical, communication",value,unknown,unknown,"build, analysis, impact"
2777,5,"business requirements, project, bpmn, user, business, problem solving, jira, agile, functional, process, scrum","analytical thinking, time, decision making, initiative, planning, business, feedback, customer, problem solving, responsibility, active, learning, technical",unknown,bachelor,unknown,"requirements, process"
